activationfunction1: Sigmoid | activationfunction2: Tanh | hidden layers: 20 | learning rate: 0.06 | iterations: 10 | training loss: 2.8174194729835215e-06 | rmse: [0.00237378] | r2 score: [0.99999437]
activationfunction1: Sigmoid | activationfunction2: Tanh | hidden layers: 20 | learning rate: 0.06 | iterations: 10 | training loss: 0.0012395736980134135 | rmse: [0.04979104] | r2 score: [0.99752085]
activationfunction1: Sigmoid | activationfunction2: Tanh | hidden layers: 20 | learning rate: 0.06 | iterations: 10 | training loss: 0.0014675137069070378 | rmse: [0.05417589] | r2 score: [0.99706497]
activationfunction1: Sigmoid | activationfunction2: Tanh | hidden layers: 20 | learning rate: 0.06 | iterations: 10 | training loss: 0.0015797963461992998 | rmse: [0.05621025] | r2 score: [0.99684041]
activationfunction1: Sigmoid | activationfunction2: Tanh | hidden layers: 20 | learning rate: 0.06 | iterations: 10 | training loss: 0.001649889792863483 | rmse: [0.05744371] | r2 score: [0.99670022]
activationfunction1: Sigmoid | activationfunction2: Tanh | hidden layers: 20 | learning rate: 0.06 | iterations: 10 | training loss: 0.0016978566535677778 | rmse: [0.05827275] | r2 score: [0.99660429]
activationfunction1: Sigmoid | activationfunction2: Tanh | hidden layers: 20 | learning rate: 0.06 | iterations: 10 | training loss: 0.001731875624151819 | rmse: [0.05885364] | r2 score: [0.99653625]
activationfunction1: Sigmoid | activationfunction2: Tanh | hidden layers: 20 | learning rate: 0.06 | iterations: 10 | training loss: 0.0017560126560881 | rmse: [0.05926234] | r2 score: [0.99648797]
activationfunction1: Sigmoid | activationfunction2: Tanh | hidden layers: 20 | learning rate: 0.06 | iterations: 10 | training loss: 0.0017726630511012496 | rmse: [0.05954264] | r2 score: [0.99645467]
activationfunction1: Sigmoid | activationfunction2: Tanh | hidden layers: 20 | learning rate: 0.06 | iterations: 10 | training loss: 0.0017834408130994628 | rmse: [0.05972338] | r2 score: [0.99643312]
[I 2023-08-01 18:27:33,779] Trial 0 finished with value: 0.9870613416929033 and parameters: {'learning_rate': 0.06, 'num_epochs': 10, 'initializer': 'Zero', 'num_hidden_units': 20}. Best is trial 0 with value: 0.9870613416929033.
activationfunction1: Sigmoid | activationfunction2: Tanh | hidden layers: 15 | learning rate: 0.03 | iterations: 5 | training loss: 0.0005830122641473387 | rmse: [0.0341471] | r2 score: [0.99883398]
activationfunction1: Sigmoid | activationfunction2: Tanh | hidden layers: 15 | learning rate: 0.03 | iterations: 5 | training loss: 0.0018536300054857078 | rmse: [0.06088727] | r2 score: [0.99629274]
activationfunction1: Sigmoid | activationfunction2: Tanh | hidden layers: 15 | learning rate: 0.03 | iterations: 5 | training loss: 0.0022667130248381477 | rmse: [0.06733072] | r2 score: [0.99546657]
activationfunction1: Sigmoid | activationfunction2: Tanh | hidden layers: 15 | learning rate: 0.03 | iterations: 5 | training loss: 0.002526609911704262 | rmse: [0.071086] | r2 score: [0.99494678]
activationfunction1: Sigmoid | activationfunction2: Tanh | hidden layers: 15 | learning rate: 0.03 | iterations: 5 | training loss: 0.0027065361569236297 | rmse: [0.07357358] | r2 score: [0.99458693]
[I 2023-08-01 18:27:59,423] Trial 1 finished with value: 0.9864642014239747 and parameters: {'learning_rate': 0.03, 'num_epochs': 5, 'initializer': 'Random', 'num_hidden_units': 15}. Best is trial 0 with value: 0.9870613416929033.
activationfunction1: Sigmoid | activationfunction2: Tanh | hidden layers: 20 | learning rate: 0.06 | iterations: 15 | training loss: 2.8174194729835215e-06 | rmse: [0.00237378] | r2 score: [0.99999437]
activationfunction1: Sigmoid | activationfunction2: Tanh | hidden layers: 20 | learning rate: 0.06 | iterations: 15 | training loss: 0.0012395736980134135 | rmse: [0.04979104] | r2 score: [0.99752085]
activationfunction1: Sigmoid | activationfunction2: Tanh | hidden layers: 20 | learning rate: 0.06 | iterations: 15 | training loss: 0.0014675137069070378 | rmse: [0.05417589] | r2 score: [0.99706497]
activationfunction1: Sigmoid | activationfunction2: Tanh | hidden layers: 20 | learning rate: 0.06 | iterations: 15 | training loss: 0.0015797963461992998 | rmse: [0.05621025] | r2 score: [0.99684041]
activationfunction1: Sigmoid | activationfunction2: Tanh | hidden layers: 20 | learning rate: 0.06 | iterations: 15 | training loss: 0.001649889792863483 | rmse: [0.05744371] | r2 score: [0.99670022]
activationfunction1: Sigmoid | activationfunction2: Tanh | hidden layers: 20 | learning rate: 0.06 | iterations: 15 | training loss: 0.0016978566535677778 | rmse: [0.05827275] | r2 score: [0.99660429]
activationfunction1: Sigmoid | activationfunction2: Tanh | hidden layers: 20 | learning rate: 0.06 | iterations: 15 | training loss: 0.001731875624151819 | rmse: [0.05885364] | r2 score: [0.99653625]
activationfunction1: Sigmoid | activationfunction2: Tanh | hidden layers: 20 | learning rate: 0.06 | iterations: 15 | training loss: 0.0017560126560881 | rmse: [0.05926234] | r2 score: [0.99648797]
activationfunction1: Sigmoid | activationfunction2: Tanh | hidden layers: 20 | learning rate: 0.06 | iterations: 15 | training loss: 0.0017726630511012496 | rmse: [0.05954264] | r2 score: [0.99645467]
activationfunction1: Sigmoid | activationfunction2: Tanh | hidden layers: 20 | learning rate: 0.06 | iterations: 15 | training loss: 0.0017834408130994628 | rmse: [0.05972338] | r2 score: [0.99643312]
activationfunction1: Sigmoid | activationfunction2: Tanh | hidden layers: 20 | learning rate: 0.06 | iterations: 15 | training loss: 0.0017895341266562388 | rmse: [0.05982532] | r2 score: [0.99642093]
activationfunction1: Sigmoid | activationfunction2: Tanh | hidden layers: 20 | learning rate: 0.06 | iterations: 15 | training loss: 0.0017918636748550842 | rmse: [0.05986424] | r2 score: [0.99641627]
activationfunction1: Sigmoid | activationfunction2: Tanh | hidden layers: 20 | learning rate: 0.06 | iterations: 15 | training loss: 0.0017911632254899422 | rmse: [0.05985254] | r2 score: [0.99641767]
activationfunction1: Sigmoid | activationfunction2: Tanh | hidden layers: 20 | learning rate: 0.06 | iterations: 15 | training loss: 0.0017880267659490209 | rmse: [0.05980011] | r2 score: [0.99642395]
[I 2023-08-01 18:29:18,601] Trial 2 finished with value: 0.9870622003312817 and parameters: {'learning_rate': 0.06, 'num_epochs': 15, 'initializer': 'Zero', 'num_hidden_units': 20}. Best is trial 2 with value: 0.9870622003312817.
activationfunction1: Sigmoid | activationfunction2: Tanh | hidden layers: 20 | learning rate: 0.06 | iterations: 15 | training loss: 0.0017829394815807812 | rmse: [0.05971498] | r2 score: [0.99643412]
activationfunction1: Sigmoid | activationfunction2: Tanh | hidden layers: 15 | learning rate: 0.01 | iterations: 15 | training loss: 1.938654448503709e-06 | rmse: [0.00196909] | r2 score: [0.99999612]
activationfunction1: Sigmoid | activationfunction2: Tanh | hidden layers: 15 | learning rate: 0.01 | iterations: 15 | training loss: 0.00470136011148247 | rmse: [0.09696762] | r2 score: [0.99059728]
activationfunction1: Sigmoid | activationfunction2: Tanh | hidden layers: 15 | learning rate: 0.01 | iterations: 15 | training loss: 0.006814747461242988 | rmse: [0.11674543] | r2 score: [0.98637051]
activationfunction1: Sigmoid | activationfunction2: Tanh | hidden layers: 15 | learning rate: 0.01 | iterations: 15 | training loss: 0.008132013263732503 | rmse: [0.1275305] | r2 score: [0.98373597]
activationfunction1: Sigmoid | activationfunction2: Tanh | hidden layers: 15 | learning rate: 0.01 | iterations: 15 | training loss: 0.009014706933551737 | rmse: [0.13427365] | r2 score: [0.98197059]
activationfunction1: Sigmoid | activationfunction2: Tanh | hidden layers: 15 | learning rate: 0.01 | iterations: 15 | training loss: 0.00962533015650443 | rmse: [0.13874675] | r2 score: [0.98074934]
activationfunction1: Sigmoid | activationfunction2: Tanh | hidden layers: 15 | learning rate: 0.01 | iterations: 15 | training loss: 0.010052947856818432 | rmse: [0.14179526] | r2 score: [0.9798941]
activationfunction1: Sigmoid | activationfunction2: Tanh | hidden layers: 15 | learning rate: 0.01 | iterations: 15 | training loss: 0.010350837027717026 | rmse: [0.14388077] | r2 score: [0.97929833]
activationfunction1: Sigmoid | activationfunction2: Tanh | hidden layers: 15 | learning rate: 0.01 | iterations: 15 | training loss: 0.0105530970877236 | rmse: [0.1452797] | r2 score: [0.97889381]
activationfunction1: Sigmoid | activationfunction2: Tanh | hidden layers: 15 | learning rate: 0.01 | iterations: 15 | training loss: 0.010682817776929846 | rmse: [0.14616989] | r2 score: [0.97863436]
activationfunction1: Sigmoid | activationfunction2: Tanh | hidden layers: 15 | learning rate: 0.01 | iterations: 15 | training loss: 0.01075636790646513 | rmse: [0.1466722] | r2 score: [0.97848726]
activationfunction1: Sigmoid | activationfunction2: Tanh | hidden layers: 15 | learning rate: 0.01 | iterations: 15 | training loss: 0.010785783380992729 | rmse: [0.14687262] | r2 score: [0.97842843]
activationfunction1: Sigmoid | activationfunction2: Tanh | hidden layers: 15 | learning rate: 0.01 | iterations: 15 | training loss: 0.010780173328229926 | rmse: [0.14683442] | r2 score: [0.97843965]
activationfunction1: Sigmoid | activationfunction2: Tanh | hidden layers: 15 | learning rate: 0.01 | iterations: 15 | training loss: 0.010746591692137283 | rmse: [0.14660554] | r2 score: [0.97850682]
[I 2023-08-01 18:30:35,660] Trial 3 finished with value: 0.9779883761409817 and parameters: {'learning_rate': 0.01, 'num_epochs': 15, 'initializer': 'Zero', 'num_hidden_units': 15}. Best is trial 2 with value: 0.9870622003312817.
activationfunction1: Sigmoid | activationfunction2: Tanh | hidden layers: 15 | learning rate: 0.01 | iterations: 15 | training loss: 0.010690602329307589 | rmse: [0.14622313] | r2 score: [0.9786188]
activationfunction1: Sigmoid | activationfunction2: Tanh | hidden layers: 15 | learning rate: 0.03 | iterations: 5 | training loss: 0.00013789333530014243 | rmse: [0.01660683] | r2 score: [0.99972421]
activationfunction1: Sigmoid | activationfunction2: Tanh | hidden layers: 15 | learning rate: 0.03 | iterations: 5 | training loss: 0.0017715599360968732 | rmse: [0.05952411] | r2 score: [0.99645688]
activationfunction1: Sigmoid | activationfunction2: Tanh | hidden layers: 15 | learning rate: 0.03 | iterations: 5 | training loss: 0.0022413541088531145 | rmse: [0.06695303] | r2 score: [0.99551729]
activationfunction1: Sigmoid | activationfunction2: Tanh | hidden layers: 15 | learning rate: 0.03 | iterations: 5 | training loss: 0.002517439719260794 | rmse: [0.07095689] | r2 score: [0.99496512]
[I 2023-08-01 18:31:01,609] Trial 4 finished with value: 0.9864659320086014 and parameters: {'learning_rate': 0.03, 'num_epochs': 5, 'initializer': 'Random', 'num_hidden_units': 15}. Best is trial 2 with value: 0.9870622003312817.
activationfunction1: Sigmoid | activationfunction2: Tanh | hidden layers: 15 | learning rate: 0.03 | iterations: 5 | training loss: 0.002703118645410601 | rmse: [0.07352712] | r2 score: [0.99459376]
activationfunction1: Sigmoid | activationfunction2: Tanh | hidden layers: 15 | learning rate: 0.01 | iterations: 15 | training loss: 1.514866691822289e-05 | rmse: [0.0055043] | r2 score: [0.9999697]
activationfunction1: Sigmoid | activationfunction2: Tanh | hidden layers: 15 | learning rate: 0.01 | iterations: 15 | training loss: 0.004702426745654208 | rmse: [0.09697863] | r2 score: [0.99059515]
activationfunction1: Sigmoid | activationfunction2: Tanh | hidden layers: 15 | learning rate: 0.01 | iterations: 15 | training loss: 0.006815642396328467 | rmse: [0.11675309] | r2 score: [0.98636872]
activationfunction1: Sigmoid | activationfunction2: Tanh | hidden layers: 15 | learning rate: 0.01 | iterations: 15 | training loss: 0.00813235980073989 | rmse: [0.12753321] | r2 score: [0.98373528]
activationfunction1: Sigmoid | activationfunction2: Tanh | hidden layers: 15 | learning rate: 0.01 | iterations: 15 | training loss: 0.009014844092283302 | rmse: [0.13427468] | r2 score: [0.98197031]
activationfunction1: Sigmoid | activationfunction2: Tanh | hidden layers: 15 | learning rate: 0.01 | iterations: 15 | training loss: 0.009625384804741025 | rmse: [0.13874714] | r2 score: [0.98074923]
activationfunction1: Sigmoid | activationfunction2: Tanh | hidden layers: 15 | learning rate: 0.01 | iterations: 15 | training loss: 0.010052969687622813 | rmse: [0.14179541] | r2 score: [0.97989406]
activationfunction1: Sigmoid | activationfunction2: Tanh | hidden layers: 15 | learning rate: 0.01 | iterations: 15 | training loss: 0.010350845761044163 | rmse: [0.14388083] | r2 score: [0.97929831]
activationfunction1: Sigmoid | activationfunction2: Tanh | hidden layers: 15 | learning rate: 0.01 | iterations: 15 | training loss: 0.010553100585290458 | rmse: [0.14527974] | r2 score: [0.9788938]
activationfunction1: Sigmoid | activationfunction2: Tanh | hidden layers: 15 | learning rate: 0.01 | iterations: 15 | training loss: 0.01068281917914449 | rmse: [0.1461699] | r2 score: [0.97863436]
activationfunction1: Sigmoid | activationfunction2: Tanh | hidden layers: 15 | learning rate: 0.01 | iterations: 15 | training loss: 0.010756368469253735 | rmse: [0.1466722] | r2 score: [0.97848726]
activationfunction1: Sigmoid | activationfunction2: Tanh | hidden layers: 15 | learning rate: 0.01 | iterations: 15 | training loss: 0.010785783607134057 | rmse: [0.14687262] | r2 score: [0.97842843]
activationfunction1: Sigmoid | activationfunction2: Tanh | hidden layers: 15 | learning rate: 0.01 | iterations: 15 | training loss: 0.010780173419206781 | rmse: [0.14683442] | r2 score: [0.97843965]
activationfunction1: Sigmoid | activationfunction2: Tanh | hidden layers: 15 | learning rate: 0.01 | iterations: 15 | training loss: 0.010746591728780992 | rmse: [0.14660554] | r2 score: [0.97850682]
activationfunction1: Sigmoid | activationfunction2: Tanh | hidden layers: 15 | learning rate: 0.01 | iterations: 15 | training loss: 0.01069060234408428 | rmse: [0.14622313] | r2 score: [0.9786188]
[I 2023-08-01 18:32:17,856] Trial 5 finished with value: 0.9779883761220352 and parameters: {'learning_rate': 0.01, 'num_epochs': 15, 'initializer': 'Xavier', 'num_hidden_units': 15}. Best is trial 2 with value: 0.9870622003312817.
activationfunction1: Sigmoid | activationfunction2: Tanh | hidden layers: 15 | learning rate: 0.06 | iterations: 5 | training loss: 0.00028879713666349766 | rmse: [0.02403319] | r2 score: [0.99942241]
activationfunction1: Sigmoid | activationfunction2: Tanh | hidden layers: 15 | learning rate: 0.06 | iterations: 5 | training loss: 0.0012826692967697572 | rmse: [0.05064917] | r2 score: [0.99743466]
activationfunction1: Sigmoid | activationfunction2: Tanh | hidden layers: 15 | learning rate: 0.06 | iterations: 5 | training loss: 0.0014783007131113368 | rmse: [0.05437464] | r2 score: [0.9970434]
activationfunction1: Sigmoid | activationfunction2: Tanh | hidden layers: 15 | learning rate: 0.06 | iterations: 5 | training loss: 0.001583298260044565 | rmse: [0.05627252] | r2 score: [0.9968334]
[I 2023-08-01 18:32:43,395] Trial 6 finished with value: 0.987138102106419 and parameters: {'learning_rate': 0.06, 'num_epochs': 5, 'initializer': 'Random', 'num_hidden_units': 15}. Best is trial 6 with value: 0.987138102106419.
activationfunction1: Sigmoid | activationfunction2: Tanh | hidden layers: 15 | learning rate: 0.06 | iterations: 5 | training loss: 0.0016510801698626301 | rmse: [0.05746443] | r2 score: [0.99669784]
activationfunction1: Sigmoid | activationfunction2: Tanh | hidden layers: 20 | learning rate: 0.06 | iterations: 5 | training loss: 2.4478076440487202e-05 | rmse: [0.00699687] | r2 score: [0.99995104]
activationfunction1: Sigmoid | activationfunction2: Tanh | hidden layers: 20 | learning rate: 0.06 | iterations: 5 | training loss: 0.001243194974245451 | rmse: [0.04986371] | r2 score: [0.99751361]
activationfunction1: Sigmoid | activationfunction2: Tanh | hidden layers: 20 | learning rate: 0.06 | iterations: 5 | training loss: 0.0014683782684393196 | rmse: [0.05419185] | r2 score: [0.99706324]
activationfunction1: Sigmoid | activationfunction2: Tanh | hidden layers: 20 | learning rate: 0.06 | iterations: 5 | training loss: 0.0015800748469897233 | rmse: [0.05621521] | r2 score: [0.99683985]
[I 2023-08-01 18:33:10,000] Trial 7 finished with value: 0.9871385290985513 and parameters: {'learning_rate': 0.06, 'num_epochs': 5, 'initializer': 'Xavier', 'num_hidden_units': 20}. Best is trial 7 with value: 0.9871385290985513.
activationfunction1: Sigmoid | activationfunction2: Tanh | hidden layers: 20 | learning rate: 0.06 | iterations: 5 | training loss: 0.001649984278200027 | rmse: [0.05744535] | r2 score: [0.99670003]
activationfunction1: Sigmoid | activationfunction2: Tanh | hidden layers: 15 | learning rate: 0.06 | iterations: 5 | training loss: 6.5220487925842e-05 | rmse: [0.01142108] | r2 score: [0.99986956]
activationfunction1: Sigmoid | activationfunction2: Tanh | hidden layers: 15 | learning rate: 0.06 | iterations: 5 | training loss: 0.001249854570018974 | rmse: [0.04999709] | r2 score: [0.99750029]
activationfunction1: Sigmoid | activationfunction2: Tanh | hidden layers: 15 | learning rate: 0.06 | iterations: 5 | training loss: 0.0014699833317338114 | rmse: [0.05422146] | r2 score: [0.99706003]
activationfunction1: Sigmoid | activationfunction2: Tanh | hidden layers: 15 | learning rate: 0.06 | iterations: 5 | training loss: 0.001580592893026451 | rmse: [0.05622442] | r2 score: [0.99683881]
activationfunction1: Sigmoid | activationfunction2: Tanh | hidden layers: 15 | learning rate: 0.06 | iterations: 5 | training loss: 0.0016501601169829978 | rmse: [0.05744841] | r2 score: [0.99669968]
[I 2023-08-01 18:33:35,781] Trial 8 finished with value: 0.9871384606155458 and parameters: {'learning_rate': 0.06, 'num_epochs': 5, 'initializer': 'Random', 'num_hidden_units': 15}. Best is trial 7 with value: 0.9871385290985513.
activationfunction1: Sigmoid | activationfunction2: Tanh | hidden layers: 10 | learning rate: 0.03 | iterations: 15 | training loss: 1.1874695259445986e-06 | rmse: [0.00154108] | r2 score: [0.99999763]
activationfunction1: Sigmoid | activationfunction2: Tanh | hidden layers: 10 | learning rate: 0.03 | iterations: 15 | training loss: 0.0017424094632181618 | rmse: [0.05903235] | r2 score: [0.99651518]
activationfunction1: Sigmoid | activationfunction2: Tanh | hidden layers: 10 | learning rate: 0.03 | iterations: 15 | training loss: 0.002232843067631453 | rmse: [0.06682579] | r2 score: [0.99553431]
activationfunction1: Sigmoid | activationfunction2: Tanh | hidden layers: 10 | learning rate: 0.03 | iterations: 15 | training loss: 0.0025143907854431333 | rmse: [0.0709139] | r2 score: [0.99497122]
activationfunction1: Sigmoid | activationfunction2: Tanh | hidden layers: 10 | learning rate: 0.03 | iterations: 15 | training loss: 0.002701985203158503 | rmse: [0.0735117] | r2 score: [0.99459603]
activationfunction1: Sigmoid | activationfunction2: Tanh | hidden layers: 10 | learning rate: 0.03 | iterations: 15 | training loss: 0.0028342708587835866 | rmse: [0.07528972] | r2 score: [0.99433146]
activationfunction1: Sigmoid | activationfunction2: Tanh | hidden layers: 10 | learning rate: 0.03 | iterations: 15 | training loss: 0.0029293822768884322 | rmse: [0.07654256] | r2 score: [0.99414124]
activationfunction1: Sigmoid | activationfunction2: Tanh | hidden layers: 10 | learning rate: 0.03 | iterations: 15 | training loss: 0.002997358821908964 | rmse: [0.07742556] | r2 score: [0.99400528]
activationfunction1: Sigmoid | activationfunction2: Tanh | hidden layers: 10 | learning rate: 0.03 | iterations: 15 | training loss: 0.0030445400538992324 | rmse: [0.07803256] | r2 score: [0.99391092]
activationfunction1: Sigmoid | activationfunction2: Tanh | hidden layers: 10 | learning rate: 0.03 | iterations: 15 | training loss: 0.003075350390030169 | rmse: [0.07842641] | r2 score: [0.9938493]
activationfunction1: Sigmoid | activationfunction2: Tanh | hidden layers: 10 | learning rate: 0.03 | iterations: 15 | training loss: 0.003093092412320386 | rmse: [0.07865231] | r2 score: [0.99381382]
activationfunction1: Sigmoid | activationfunction2: Tanh | hidden layers: 10 | learning rate: 0.03 | iterations: 15 | training loss: 0.0031003355238873884 | rmse: [0.07874434] | r2 score: [0.99379933]
activationfunction1: Sigmoid | activationfunction2: Tanh | hidden layers: 10 | learning rate: 0.03 | iterations: 15 | training loss: 0.0030991284402600455 | rmse: [0.07872901] | r2 score: [0.99380174]
activationfunction1: Sigmoid | activationfunction2: Tanh | hidden layers: 10 | learning rate: 0.03 | iterations: 15 | training loss: 0.0030911287634951914 | rmse: [0.07862733] | r2 score: [0.99381774]
