[I 2023-08-01 18:58:08,305] Trial 50 finished with value: 0.9870613416956365 and parameters: {'learning_rate': 0.06, 'num_epochs': 10, 'initializer': 'Xavier', 'num_hidden_units': 10}. Best is trial 42 with value: 0.9871385665896193.
activationfunction1: Sigmoid | activationfunction2: Tanh | hidden layers: 10 | learning rate: 0.06 | iterations: 10 | training loss: 0.0017834408064941673 | rmse: [0.05972338] | r2 score: [0.99643312]
activationfunction1: Sigmoid | activationfunction2: Tanh | hidden layers: 10 | learning rate: 0.06 | iterations: 5 | training loss: 2.1706375430589196e-05 | rmse: [0.00658884] | r2 score: [0.99995659]
activationfunction1: Sigmoid | activationfunction2: Tanh | hidden layers: 10 | learning rate: 0.06 | iterations: 5 | training loss: 0.0012427336967084906 | rmse: [0.04985446] | r2 score: [0.99751453]
activationfunction1: Sigmoid | activationfunction2: Tanh | hidden layers: 10 | learning rate: 0.06 | iterations: 5 | training loss: 0.0014682679832672045 | rmse: [0.05418982] | r2 score: [0.99706346]
activationfunction1: Sigmoid | activationfunction2: Tanh | hidden layers: 10 | learning rate: 0.06 | iterations: 5 | training loss: 0.001580039299713877 | rmse: [0.05621457] | r2 score: [0.99683992]
[I 2023-08-01 18:58:33,997] Trial 51 finished with value: 0.987138533795744 and parameters: {'learning_rate': 0.06, 'num_epochs': 5, 'initializer': 'Xavier', 'num_hidden_units': 10}. Best is trial 42 with value: 0.9871385665896193.
activationfunction1: Sigmoid | activationfunction2: Tanh | hidden layers: 10 | learning rate: 0.06 | iterations: 5 | training loss: 0.0016499722165178457 | rmse: [0.05744514] | r2 score: [0.99670006]
activationfunction1: Sigmoid | activationfunction2: Tanh | hidden layers: 10 | learning rate: 0.06 | iterations: 5 | training loss: 1.412481905219249e-05 | rmse: [0.00531504] | r2 score: [0.99997175]
activationfunction1: Sigmoid | activationfunction2: Tanh | hidden layers: 10 | learning rate: 0.06 | iterations: 5 | training loss: 0.0012414673779659428 | rmse: [0.04982905] | r2 score: [0.99751707]
activationfunction1: Sigmoid | activationfunction2: Tanh | hidden layers: 10 | learning rate: 0.06 | iterations: 5 | training loss: 0.001467965666257112 | rmse: [0.05418424] | r2 score: [0.99706407]
activationfunction1: Sigmoid | activationfunction2: Tanh | hidden layers: 10 | learning rate: 0.06 | iterations: 5 | training loss: 0.0015799418881909492 | rmse: [0.05621284] | r2 score: [0.99684012]
activationfunction1: Sigmoid | activationfunction2: Tanh | hidden layers: 10 | learning rate: 0.06 | iterations: 5 | training loss: 0.0016499391660887582 | rmse: [0.05744457] | r2 score: [0.99670012]
[I 2023-08-01 18:58:59,082] Trial 52 finished with value: 0.9871385466663374 and parameters: {'learning_rate': 0.06, 'num_epochs': 5, 'initializer': 'Xavier', 'num_hidden_units': 10}. Best is trial 42 with value: 0.9871385665896193.
activationfunction1: Sigmoid | activationfunction2: Tanh | hidden layers: 10 | learning rate: 0.06 | iterations: 5 | training loss: 9.792383806851664e-06 | rmse: [0.00442547] | r2 score: [0.99998042]
activationfunction1: Sigmoid | activationfunction2: Tanh | hidden layers: 10 | learning rate: 0.06 | iterations: 5 | training loss: 0.0012407414708827077 | rmse: [0.04981449] | r2 score: [0.99751852]
activationfunction1: Sigmoid | activationfunction2: Tanh | hidden layers: 10 | learning rate: 0.06 | iterations: 5 | training loss: 0.0014677925572884082 | rmse: [0.05418104] | r2 score: [0.99706441]
activationfunction1: Sigmoid | activationfunction2: Tanh | hidden layers: 10 | learning rate: 0.06 | iterations: 5 | training loss: 0.0015798861305709332 | rmse: [0.05621185] | r2 score: [0.99684023]
activationfunction1: Sigmoid | activationfunction2: Tanh | hidden layers: 10 | learning rate: 0.06 | iterations: 5 | training loss: 0.001649920250018718 | rmse: [0.05744424] | r2 score: [0.99670016]
[I 2023-08-01 18:59:24,648] Trial 53 finished with value: 0.9871385540325113 and parameters: {'learning_rate': 0.06, 'num_epochs': 5, 'initializer': 'Xavier', 'num_hidden_units': 10}. Best is trial 42 with value: 0.9871385665896193.
activationfunction1: Sigmoid | activationfunction2: Tanh | hidden layers: 10 | learning rate: 0.06 | iterations: 5 | training loss: 3.362384731053299e-05 | rmse: [0.00820047] | r2 score: [0.99993275]
activationfunction1: Sigmoid | activationfunction2: Tanh | hidden layers: 10 | learning rate: 0.06 | iterations: 5 | training loss: 0.0012447099534934076 | rmse: [0.04989409] | r2 score: [0.99751058]
activationfunction1: Sigmoid | activationfunction2: Tanh | hidden layers: 10 | learning rate: 0.06 | iterations: 5 | training loss: 0.0014687412134594651 | rmse: [0.05419855] | r2 score: [0.99706252]
activationfunction1: Sigmoid | activationfunction2: Tanh | hidden layers: 10 | learning rate: 0.06 | iterations: 5 | training loss: 0.0015801918756296717 | rmse: [0.05621729] | r2 score: [0.99683962]
[I 2023-08-01 18:59:49,439] Trial 54 finished with value: 0.987138513632676 and parameters: {'learning_rate': 0.06, 'num_epochs': 5, 'initializer': 'Xavier', 'num_hidden_units': 10}. Best is trial 42 with value: 0.9871385665896193.
activationfunction1: Sigmoid | activationfunction2: Tanh | hidden layers: 10 | learning rate: 0.06 | iterations: 5 | training loss: 0.001650023991285041 | rmse: [0.05744604] | r2 score: [0.99669995]
activationfunction1: Sigmoid | activationfunction2: Tanh | hidden layers: 10 | learning rate: 0.06 | iterations: 5 | training loss: 6.054322874254105e-06 | rmse: [0.00347975] | r2 score: [0.99998789]
activationfunction1: Sigmoid | activationfunction2: Tanh | hidden layers: 10 | learning rate: 0.06 | iterations: 5 | training loss: 0.0012401148723720818 | rmse: [0.0498019] | r2 score: [0.99751977]
activationfunction1: Sigmoid | activationfunction2: Tanh | hidden layers: 10 | learning rate: 0.06 | iterations: 5 | training loss: 0.0014676430954286247 | rmse: [0.05417828] | r2 score: [0.99706471]
activationfunction1: Sigmoid | activationfunction2: Tanh | hidden layers: 10 | learning rate: 0.06 | iterations: 5 | training loss: 0.0015798380018503045 | rmse: [0.05621099] | r2 score: [0.99684032]
[I 2023-08-01 19:00:14,540] Trial 55 finished with value: 0.9871385603903251 and parameters: {'learning_rate': 0.06, 'num_epochs': 5, 'initializer': 'Xavier', 'num_hidden_units': 10}. Best is trial 42 with value: 0.9871385665896193.
activationfunction1: Sigmoid | activationfunction2: Tanh | hidden layers: 10 | learning rate: 0.06 | iterations: 5 | training loss: 0.0016499039231157686 | rmse: [0.05744395] | r2 score: [0.99670019]
activationfunction1: Sigmoid | activationfunction2: Tanh | hidden layers: 15 | learning rate: 0.06 | iterations: 5 | training loss: 1.1252601508538028e-05 | rmse: [0.00474396] | r2 score: [0.99997749]
activationfunction1: Sigmoid | activationfunction2: Tanh | hidden layers: 15 | learning rate: 0.06 | iterations: 5 | training loss: 0.001240986224995938 | rmse: [0.0498194] | r2 score: [0.99751803]
activationfunction1: Sigmoid | activationfunction2: Tanh | hidden layers: 15 | learning rate: 0.06 | iterations: 5 | training loss: 0.0014678509185151404 | rmse: [0.05418212] | r2 score: [0.9970643]
activationfunction1: Sigmoid | activationfunction2: Tanh | hidden layers: 15 | learning rate: 0.06 | iterations: 5 | training loss: 0.0015799049267550545 | rmse: [0.05621219] | r2 score: [0.99684019]
activationfunction1: Sigmoid | activationfunction2: Tanh | hidden layers: 15 | learning rate: 0.06 | iterations: 5 | training loss: 0.0016499266265824143 | rmse: [0.05744435] | r2 score: [0.99670015]
[I 2023-08-01 19:00:41,209] Trial 56 finished with value: 0.9871385515494053 and parameters: {'learning_rate': 0.06, 'num_epochs': 5, 'initializer': 'Xavier', 'num_hidden_units': 15}. Best is trial 42 with value: 0.9871385665896193.
activationfunction1: Sigmoid | activationfunction2: Tanh | hidden layers: 10 | learning rate: 0.03 | iterations: 5 | training loss: 8.427511652463746e-07 | rmse: [0.00129827] | r2 score: [0.99999831]
activationfunction1: Sigmoid | activationfunction2: Tanh | hidden layers: 10 | learning rate: 0.03 | iterations: 5 | training loss: 0.0017423467782303607 | rmse: [0.05903129] | r2 score: [0.99651531]
activationfunction1: Sigmoid | activationfunction2: Tanh | hidden layers: 10 | learning rate: 0.03 | iterations: 5 | training loss: 0.0022328229062880556 | rmse: [0.06682549] | r2 score: [0.99553435]
activationfunction1: Sigmoid | activationfunction2: Tanh | hidden layers: 10 | learning rate: 0.03 | iterations: 5 | training loss: 0.002514383580428869 | rmse: [0.0709138] | r2 score: [0.99497123]
activationfunction1: Sigmoid | activationfunction2: Tanh | hidden layers: 10 | learning rate: 0.03 | iterations: 5 | training loss: 0.002701982526368023 | rmse: [0.07351167] | r2 score: [0.99459603]
[I 2023-08-01 19:01:08,276] Trial 57 finished with value: 0.9864665069598448 and parameters: {'learning_rate': 0.03, 'num_epochs': 5, 'initializer': 'Xavier', 'num_hidden_units': 10}. Best is trial 42 with value: 0.9871385665896193.
activationfunction1: Sigmoid | activationfunction2: Tanh | hidden layers: 10 | learning rate: 0.06 | iterations: 5 | training loss: 2.2868554394954456e-06 | rmse: [0.00213862] | r2 score: [0.99999543]
activationfunction1: Sigmoid | activationfunction2: Tanh | hidden layers: 10 | learning rate: 0.06 | iterations: 5 | training loss: 0.0012394855087287787 | rmse: [0.04978926] | r2 score: [0.99752103]
activationfunction1: Sigmoid | activationfunction2: Tanh | hidden layers: 10 | learning rate: 0.06 | iterations: 5 | training loss: 0.0014674925431788902 | rmse: [0.0541755] | r2 score: [0.99706501]
activationfunction1: Sigmoid | activationfunction2: Tanh | hidden layers: 10 | learning rate: 0.06 | iterations: 5 | training loss: 0.0015797895335092238 | rmse: [0.05621013] | r2 score: [0.99684042]
activationfunction1: Sigmoid | activationfunction2: Tanh | hidden layers: 10 | learning rate: 0.06 | iterations: 5 | training loss: 0.0016498874819593225 | rmse: [0.05744367] | r2 score: [0.99670023]
[I 2023-08-01 19:01:33,901] Trial 58 finished with value: 0.9871385667925332 and parameters: {'learning_rate': 0.06, 'num_epochs': 5, 'initializer': 'Xavier', 'num_hidden_units': 10}. Best is trial 58 with value: 0.9871385667925332.
activationfunction1: Sigmoid | activationfunction2: Tanh | hidden layers: 10 | learning rate: 0.01 | iterations: 5 | training loss: 1.4204916073191226e-05 | rmse: [0.00533009] | r2 score: [0.99997159]
activationfunction1: Sigmoid | activationfunction2: Tanh | hidden layers: 10 | learning rate: 0.01 | iterations: 5 | training loss: 0.004702243682332787 | rmse: [0.09697673] | r2 score: [0.99059551]
activationfunction1: Sigmoid | activationfunction2: Tanh | hidden layers: 10 | learning rate: 0.01 | iterations: 5 | training loss: 0.006815557299043927 | rmse: [0.11675236] | r2 score: [0.98636889]
activationfunction1: Sigmoid | activationfunction2: Tanh | hidden layers: 10 | learning rate: 0.01 | iterations: 5 | training loss: 0.008132326847986815 | rmse: [0.12753294] | r2 score: [0.98373535]
activationfunction1: Sigmoid | activationfunction2: Tanh | hidden layers: 10 | learning rate: 0.01 | iterations: 5 | training loss: 0.009014831049470224 | rmse: [0.13427457] | r2 score: [0.98197034]
[I 2023-08-01 19:02:02,253] Trial 59 finished with value: 0.9803578621301018 and parameters: {'learning_rate': 0.01, 'num_epochs': 5, 'initializer': 'Xavier', 'num_hidden_units': 10}. Best is trial 58 with value: 0.9871385667925332.
activationfunction1: Sigmoid | activationfunction2: Tanh | hidden layers: 10 | learning rate: 0.06 | iterations: 10 | training loss: 6.2434084459913956e-06 | rmse: [0.00353367] | r2 score: [0.99998751]
activationfunction1: Sigmoid | activationfunction2: Tanh | hidden layers: 10 | learning rate: 0.06 | iterations: 10 | training loss: 0.0012401474556354426 | rmse: [0.04980256] | r2 score: [0.99751971]
activationfunction1: Sigmoid | activationfunction2: Tanh | hidden layers: 10 | learning rate: 0.06 | iterations: 10 | training loss: 0.001467650872170096 | rmse: [0.05417842] | r2 score: [0.9970647]
activationfunction1: Sigmoid | activationfunction2: Tanh | hidden layers: 10 | learning rate: 0.06 | iterations: 10 | training loss: 0.0015798405057847048 | rmse: [0.05621104] | r2 score: [0.99684032]
activationfunction1: Sigmoid | activationfunction2: Tanh | hidden layers: 10 | learning rate: 0.06 | iterations: 10 | training loss: 0.0016499047725123252 | rmse: [0.05744397] | r2 score: [0.99670019]
activationfunction1: Sigmoid | activationfunction2: Tanh | hidden layers: 10 | learning rate: 0.06 | iterations: 10 | training loss: 0.0016978618011732742 | rmse: [0.05827284] | r2 score: [0.99660428]
activationfunction1: Sigmoid | activationfunction2: Tanh | hidden layers: 10 | learning rate: 0.06 | iterations: 10 | training loss: 0.0017318773991101002 | rmse: [0.05885367] | r2 score: [0.99653625]
activationfunction1: Sigmoid | activationfunction2: Tanh | hidden layers: 10 | learning rate: 0.06 | iterations: 10 | training loss: 0.0017560132684921242 | rmse: [0.05926235] | r2 score: [0.99648797]
activationfunction1: Sigmoid | activationfunction2: Tanh | hidden layers: 10 | learning rate: 0.06 | iterations: 10 | training loss: 0.0017726632623277856 | rmse: [0.05954264] | r2 score: [0.99645467]
activationfunction1: Sigmoid | activationfunction2: Tanh | hidden layers: 10 | learning rate: 0.06 | iterations: 10 | training loss: 0.0017834408859033917 | rmse: [0.05972338] | r2 score: [0.99643312]
[I 2023-08-01 19:02:53,337] Trial 60 finished with value: 0.9870613416627777 and parameters: {'learning_rate': 0.06, 'num_epochs': 10, 'initializer': 'Xavier', 'num_hidden_units': 10}. Best is trial 58 with value: 0.9871385667925332.
activationfunction1: Sigmoid | activationfunction2: Tanh | hidden layers: 10 | learning rate: 0.06 | iterations: 5 | training loss: 3.69377663558823e-05 | rmse: [0.00859509] | r2 score: [0.99992612]
activationfunction1: Sigmoid | activationfunction2: Tanh | hidden layers: 10 | learning rate: 0.06 | iterations: 5 | training loss: 0.0012452560950664308 | rmse: [0.04990503] | r2 score: [0.99750949]
activationfunction1: Sigmoid | activationfunction2: Tanh | hidden layers: 10 | learning rate: 0.06 | iterations: 5 | training loss: 0.001468872350117719 | rmse: [0.05420097] | r2 score: [0.99706226]
activationfunction1: Sigmoid | activationfunction2: Tanh | hidden layers: 10 | learning rate: 0.06 | iterations: 5 | training loss: 0.0015802341760393975 | rmse: [0.05621804] | r2 score: [0.99683953]
activationfunction1: Sigmoid | activationfunction2: Tanh | hidden layers: 10 | learning rate: 0.06 | iterations: 5 | training loss: 0.0016500383470953101 | rmse: [0.05744629] | r2 score: [0.99669992]
[I 2023-08-01 19:03:19,568] Trial 61 finished with value: 0.9871385080418057 and parameters: {'learning_rate': 0.06, 'num_epochs': 5, 'initializer': 'Xavier', 'num_hidden_units': 10}. Best is trial 58 with value: 0.9871385667925332.
activationfunction1: Sigmoid | activationfunction2: Tanh | hidden layers: 10 | learning rate: 0.06 | iterations: 5 | training loss: 7.399149469278576e-06 | rmse: [0.00384686] | r2 score: [0.9999852]
activationfunction1: Sigmoid | activationfunction2: Tanh | hidden layers: 10 | learning rate: 0.06 | iterations: 5 | training loss: 0.0012403414411688513 | rmse: [0.04980645] | r2 score: [0.99751932]
activationfunction1: Sigmoid | activationfunction2: Tanh | hidden layers: 10 | learning rate: 0.06 | iterations: 5 | training loss: 0.0014676971564432037 | rmse: [0.05417928] | r2 score: [0.99706461]
activationfunction1: Sigmoid | activationfunction2: Tanh | hidden layers: 10 | learning rate: 0.06 | iterations: 5 | training loss: 0.0015798554089080882 | rmse: [0.05621131] | r2 score: [0.99684029]
[I 2023-08-01 19:03:45,478] Trial 62 finished with value: 0.9871385580909028 and parameters: {'learning_rate': 0.06, 'num_epochs': 5, 'initializer': 'Xavier', 'num_hidden_units': 10}. Best is trial 58 with value: 0.9871385667925332.
activationfunction1: Sigmoid | activationfunction2: Tanh | hidden layers: 10 | learning rate: 0.06 | iterations: 5 | training loss: 0.0016499098280739022 | rmse: [0.05744406] | r2 score: [0.99670018]
activationfunction1: Sigmoid | activationfunction2: Tanh | hidden layers: 10 | learning rate: 0.06 | iterations: 5 | training loss: 5.311577006620573e-06 | rmse: [0.00325932] | r2 score: [0.99998938]
activationfunction1: Sigmoid | activationfunction2: Tanh | hidden layers: 10 | learning rate: 0.06 | iterations: 5 | training loss: 0.0012399904597166123 | rmse: [0.04979941] | r2 score: [0.99752002]
activationfunction1: Sigmoid | activationfunction2: Tanh | hidden layers: 10 | learning rate: 0.06 | iterations: 5 | training loss: 0.0014676133925011494 | rmse: [0.05417774] | r2 score: [0.99706477]
activationfunction1: Sigmoid | activationfunction2: Tanh | hidden layers: 10 | learning rate: 0.06 | iterations: 5 | training loss: 0.0015798284384646662 | rmse: [0.05621083] | r2 score: [0.99684034]
activationfunction1: Sigmoid | activationfunction2: Tanh | hidden layers: 10 | learning rate: 0.06 | iterations: 5 | training loss: 0.0016499006790021214 | rmse: [0.0574439] | r2 score: [0.9967002]
[I 2023-08-01 19:04:10,479] Trial 63 finished with value: 0.9871385616535949 and parameters: {'learning_rate': 0.06, 'num_epochs': 5, 'initializer': 'Xavier', 'num_hidden_units': 10}. Best is trial 58 with value: 0.9871385667925332.
activationfunction1: Sigmoid | activationfunction2: Tanh | hidden layers: 10 | learning rate: 0.06 | iterations: 5 | training loss: 4.939432762556375e-06 | rmse: [0.00314307] | r2 score: [0.99999012]
activationfunction1: Sigmoid | activationfunction2: Tanh | hidden layers: 10 | learning rate: 0.06 | iterations: 5 | training loss: 0.0012399281544275827 | rmse: [0.04979816] | r2 score: [0.99752014]
activationfunction1: Sigmoid | activationfunction2: Tanh | hidden layers: 10 | learning rate: 0.06 | iterations: 5 | training loss: 0.0014675985108832607 | rmse: [0.05417746] | r2 score: [0.9970648]
activationfunction1: Sigmoid | activationfunction2: Tanh | hidden layers: 10 | learning rate: 0.06 | iterations: 5 | training loss: 0.001579823647232117 | rmse: [0.05621074] | r2 score: [0.99684035]
[I 2023-08-01 19:04:36,499] Trial 64 finished with value: 0.9871385622864831 and parameters: {'learning_rate': 0.06, 'num_epochs': 5, 'initializer': 'Xavier', 'num_hidden_units': 10}. Best is trial 58 with value: 0.9871385667925332.
activationfunction1: Sigmoid | activationfunction2: Tanh | hidden layers: 10 | learning rate: 0.06 | iterations: 5 | training loss: 0.0016498990537232702 | rmse: [0.05744387] | r2 score: [0.9967002]
activationfunction1: Sigmoid | activationfunction2: Tanh | hidden layers: 10 | learning rate: 0.06 | iterations: 5 | training loss: 2.2956611731624623e-05 | rmse: [0.00677593] | r2 score: [0.99995409]
activationfunction1: Sigmoid | activationfunction2: Tanh | hidden layers: 10 | learning rate: 0.06 | iterations: 5 | training loss: 0.001242941884617669 | rmse: [0.04985864] | r2 score: [0.99751412]
activationfunction1: Sigmoid | activationfunction2: Tanh | hidden layers: 10 | learning rate: 0.06 | iterations: 5 | training loss: 0.0014683177461710978 | rmse: [0.05419073] | r2 score: [0.99706336]
activationfunction1: Sigmoid | activationfunction2: Tanh | hidden layers: 10 | learning rate: 0.06 | iterations: 5 | training loss: 0.001580055338598845 | rmse: [0.05621486] | r2 score: [0.99683989]
activationfunction1: Sigmoid | activationfunction2: Tanh | hidden layers: 10 | learning rate: 0.06 | iterations: 5 | training loss: 0.0016499776586693248 | rmse: [0.05744524] | r2 score: [0.99670004]
