[I 2023-08-01 19:12:58,417] Trial 78 finished with value: 0.9870622003312817 and parameters: {'learning_rate': 0.06, 'num_epochs': 15, 'initializer': 'Zero', 'num_hidden_units': 20}. Best is trial 58 with value: 0.9871385667925332.
activationfunction1: Sigmoid | activationfunction2: Tanh | hidden layers: 10 | learning rate: 0.06 | iterations: 5 | training loss: 2.8174194729835215e-06 | rmse: [0.00237378] | r2 score: [0.99999437]
activationfunction1: Sigmoid | activationfunction2: Tanh | hidden layers: 10 | learning rate: 0.06 | iterations: 5 | training loss: 0.0012395736980134135 | rmse: [0.04979104] | r2 score: [0.99752085]
activationfunction1: Sigmoid | activationfunction2: Tanh | hidden layers: 10 | learning rate: 0.06 | iterations: 5 | training loss: 0.0014675137069070378 | rmse: [0.05417589] | r2 score: [0.99706497]
activationfunction1: Sigmoid | activationfunction2: Tanh | hidden layers: 10 | learning rate: 0.06 | iterations: 5 | training loss: 0.0015797963461992998 | rmse: [0.05621025] | r2 score: [0.99684041]
[I 2023-08-01 19:13:26,322] Trial 79 finished with value: 0.9871385658926699 and parameters: {'learning_rate': 0.06, 'num_epochs': 5, 'initializer': 'Zero', 'num_hidden_units': 10}. Best is trial 58 with value: 0.9871385667925332.
activationfunction1: Sigmoid | activationfunction2: Tanh | hidden layers: 10 | learning rate: 0.06 | iterations: 5 | training loss: 0.001649889792863483 | rmse: [0.05744371] | r2 score: [0.99670022]
activationfunction1: Sigmoid | activationfunction2: Tanh | hidden layers: 10 | learning rate: 0.06 | iterations: 5 | training loss: 2.8174194729835215e-06 | rmse: [0.00237378] | r2 score: [0.99999437]
activationfunction1: Sigmoid | activationfunction2: Tanh | hidden layers: 10 | learning rate: 0.06 | iterations: 5 | training loss: 0.0012395736980134135 | rmse: [0.04979104] | r2 score: [0.99752085]
activationfunction1: Sigmoid | activationfunction2: Tanh | hidden layers: 10 | learning rate: 0.06 | iterations: 5 | training loss: 0.0014675137069070378 | rmse: [0.05417589] | r2 score: [0.99706497]
activationfunction1: Sigmoid | activationfunction2: Tanh | hidden layers: 10 | learning rate: 0.06 | iterations: 5 | training loss: 0.0015797963461992998 | rmse: [0.05621025] | r2 score: [0.99684041]
[I 2023-08-01 19:13:51,551] Trial 80 finished with value: 0.9871385658926699 and parameters: {'learning_rate': 0.06, 'num_epochs': 5, 'initializer': 'Zero', 'num_hidden_units': 10}. Best is trial 58 with value: 0.9871385667925332.
activationfunction1: Sigmoid | activationfunction2: Tanh | hidden layers: 10 | learning rate: 0.06 | iterations: 5 | training loss: 0.001649889792863483 | rmse: [0.05744371] | r2 score: [0.99670022]
activationfunction1: Sigmoid | activationfunction2: Tanh | hidden layers: 10 | learning rate: 0.06 | iterations: 5 | training loss: 2.8174194729835215e-06 | rmse: [0.00237378] | r2 score: [0.99999437]
activationfunction1: Sigmoid | activationfunction2: Tanh | hidden layers: 10 | learning rate: 0.06 | iterations: 5 | training loss: 0.0012395736980134135 | rmse: [0.04979104] | r2 score: [0.99752085]
activationfunction1: Sigmoid | activationfunction2: Tanh | hidden layers: 10 | learning rate: 0.06 | iterations: 5 | training loss: 0.0014675137069070378 | rmse: [0.05417589] | r2 score: [0.99706497]
activationfunction1: Sigmoid | activationfunction2: Tanh | hidden layers: 10 | learning rate: 0.06 | iterations: 5 | training loss: 0.0015797963461992998 | rmse: [0.05621025] | r2 score: [0.99684041]
[I 2023-08-01 19:14:18,025] Trial 81 finished with value: 0.9871385658926699 and parameters: {'learning_rate': 0.06, 'num_epochs': 5, 'initializer': 'Zero', 'num_hidden_units': 10}. Best is trial 58 with value: 0.9871385667925332.
activationfunction1: Sigmoid | activationfunction2: Tanh | hidden layers: 10 | learning rate: 0.06 | iterations: 5 | training loss: 0.001649889792863483 | rmse: [0.05744371] | r2 score: [0.99670022]
activationfunction1: Sigmoid | activationfunction2: Tanh | hidden layers: 10 | learning rate: 0.06 | iterations: 5 | training loss: 2.8174194729835215e-06 | rmse: [0.00237378] | r2 score: [0.99999437]
activationfunction1: Sigmoid | activationfunction2: Tanh | hidden layers: 10 | learning rate: 0.06 | iterations: 5 | training loss: 0.0012395736980134135 | rmse: [0.04979104] | r2 score: [0.99752085]
activationfunction1: Sigmoid | activationfunction2: Tanh | hidden layers: 10 | learning rate: 0.06 | iterations: 5 | training loss: 0.0014675137069070378 | rmse: [0.05417589] | r2 score: [0.99706497]
activationfunction1: Sigmoid | activationfunction2: Tanh | hidden layers: 10 | learning rate: 0.06 | iterations: 5 | training loss: 0.0015797963461992998 | rmse: [0.05621025] | r2 score: [0.99684041]
[I 2023-08-01 19:14:44,945] Trial 82 finished with value: 0.9871385658926699 and parameters: {'learning_rate': 0.06, 'num_epochs': 5, 'initializer': 'Zero', 'num_hidden_units': 10}. Best is trial 58 with value: 0.9871385667925332.
activationfunction1: Sigmoid | activationfunction2: Tanh | hidden layers: 10 | learning rate: 0.06 | iterations: 5 | training loss: 0.001649889792863483 | rmse: [0.05744371] | r2 score: [0.99670022]
activationfunction1: Sigmoid | activationfunction2: Tanh | hidden layers: 10 | learning rate: 0.06 | iterations: 5 | training loss: 2.8174194729835215e-06 | rmse: [0.00237378] | r2 score: [0.99999437]
activationfunction1: Sigmoid | activationfunction2: Tanh | hidden layers: 10 | learning rate: 0.06 | iterations: 5 | training loss: 0.0012395736980134135 | rmse: [0.04979104] | r2 score: [0.99752085]
activationfunction1: Sigmoid | activationfunction2: Tanh | hidden layers: 10 | learning rate: 0.06 | iterations: 5 | training loss: 0.0014675137069070378 | rmse: [0.05417589] | r2 score: [0.99706497]
activationfunction1: Sigmoid | activationfunction2: Tanh | hidden layers: 10 | learning rate: 0.06 | iterations: 5 | training loss: 0.0015797963461992998 | rmse: [0.05621025] | r2 score: [0.99684041]
[I 2023-08-01 19:15:09,850] Trial 83 finished with value: 0.9871385658926699 and parameters: {'learning_rate': 0.06, 'num_epochs': 5, 'initializer': 'Zero', 'num_hidden_units': 10}. Best is trial 58 with value: 0.9871385667925332.
activationfunction1: Sigmoid | activationfunction2: Tanh | hidden layers: 10 | learning rate: 0.06 | iterations: 5 | training loss: 0.001649889792863483 | rmse: [0.05744371] | r2 score: [0.99670022]
activationfunction1: Sigmoid | activationfunction2: Tanh | hidden layers: 10 | learning rate: 0.06 | iterations: 5 | training loss: 2.8174194729835215e-06 | rmse: [0.00237378] | r2 score: [0.99999437]
activationfunction1: Sigmoid | activationfunction2: Tanh | hidden layers: 10 | learning rate: 0.06 | iterations: 5 | training loss: 0.0012395736980134135 | rmse: [0.04979104] | r2 score: [0.99752085]
activationfunction1: Sigmoid | activationfunction2: Tanh | hidden layers: 10 | learning rate: 0.06 | iterations: 5 | training loss: 0.0014675137069070378 | rmse: [0.05417589] | r2 score: [0.99706497]
activationfunction1: Sigmoid | activationfunction2: Tanh | hidden layers: 10 | learning rate: 0.06 | iterations: 5 | training loss: 0.0015797963461992998 | rmse: [0.05621025] | r2 score: [0.99684041]
activationfunction1: Sigmoid | activationfunction2: Tanh | hidden layers: 10 | learning rate: 0.06 | iterations: 5 | training loss: 0.001649889792863483 | rmse: [0.05744371] | r2 score: [0.99670022]
[I 2023-08-01 19:15:37,501] Trial 84 finished with value: 0.9871385658926699 and parameters: {'learning_rate': 0.06, 'num_epochs': 5, 'initializer': 'Zero', 'num_hidden_units': 10}. Best is trial 58 with value: 0.9871385667925332.
activationfunction1: Sigmoid | activationfunction2: Tanh | hidden layers: 10 | learning rate: 0.06 | iterations: 5 | training loss: 2.8174194729835215e-06 | rmse: [0.00237378] | r2 score: [0.99999437]
activationfunction1: Sigmoid | activationfunction2: Tanh | hidden layers: 10 | learning rate: 0.06 | iterations: 5 | training loss: 0.0012395736980134135 | rmse: [0.04979104] | r2 score: [0.99752085]
activationfunction1: Sigmoid | activationfunction2: Tanh | hidden layers: 10 | learning rate: 0.06 | iterations: 5 | training loss: 0.0014675137069070378 | rmse: [0.05417589] | r2 score: [0.99706497]
activationfunction1: Sigmoid | activationfunction2: Tanh | hidden layers: 10 | learning rate: 0.06 | iterations: 5 | training loss: 0.0015797963461992998 | rmse: [0.05621025] | r2 score: [0.99684041]
[I 2023-08-01 19:16:03,073] Trial 85 finished with value: 0.9871385658926699 and parameters: {'learning_rate': 0.06, 'num_epochs': 5, 'initializer': 'Zero', 'num_hidden_units': 10}. Best is trial 58 with value: 0.9871385667925332.
activationfunction1: Sigmoid | activationfunction2: Tanh | hidden layers: 10 | learning rate: 0.06 | iterations: 5 | training loss: 0.001649889792863483 | rmse: [0.05744371] | r2 score: [0.99670022]
activationfunction1: Sigmoid | activationfunction2: Tanh | hidden layers: 10 | learning rate: 0.06 | iterations: 5 | training loss: 2.8174194729835215e-06 | rmse: [0.00237378] | r2 score: [0.99999437]
activationfunction1: Sigmoid | activationfunction2: Tanh | hidden layers: 10 | learning rate: 0.06 | iterations: 5 | training loss: 0.0012395736980134135 | rmse: [0.04979104] | r2 score: [0.99752085]
activationfunction1: Sigmoid | activationfunction2: Tanh | hidden layers: 10 | learning rate: 0.06 | iterations: 5 | training loss: 0.0014675137069070378 | rmse: [0.05417589] | r2 score: [0.99706497]
activationfunction1: Sigmoid | activationfunction2: Tanh | hidden layers: 10 | learning rate: 0.06 | iterations: 5 | training loss: 0.0015797963461992998 | rmse: [0.05621025] | r2 score: [0.99684041]
activationfunction1: Sigmoid | activationfunction2: Tanh | hidden layers: 10 | learning rate: 0.06 | iterations: 5 | training loss: 0.001649889792863483 | rmse: [0.05744371] | r2 score: [0.99670022]
[I 2023-08-01 19:16:29,558] Trial 86 finished with value: 0.9871385658926699 and parameters: {'learning_rate': 0.06, 'num_epochs': 5, 'initializer': 'Zero', 'num_hidden_units': 10}. Best is trial 58 with value: 0.9871385667925332.
activationfunction1: Sigmoid | activationfunction2: Tanh | hidden layers: 10 | learning rate: 0.06 | iterations: 5 | training loss: 2.8174194729835215e-06 | rmse: [0.00237378] | r2 score: [0.99999437]
activationfunction1: Sigmoid | activationfunction2: Tanh | hidden layers: 10 | learning rate: 0.06 | iterations: 5 | training loss: 0.0012395736980134135 | rmse: [0.04979104] | r2 score: [0.99752085]
activationfunction1: Sigmoid | activationfunction2: Tanh | hidden layers: 10 | learning rate: 0.06 | iterations: 5 | training loss: 0.0014675137069070378 | rmse: [0.05417589] | r2 score: [0.99706497]
activationfunction1: Sigmoid | activationfunction2: Tanh | hidden layers: 10 | learning rate: 0.06 | iterations: 5 | training loss: 0.0015797963461992998 | rmse: [0.05621025] | r2 score: [0.99684041]
activationfunction1: Sigmoid | activationfunction2: Tanh | hidden layers: 10 | learning rate: 0.06 | iterations: 5 | training loss: 0.001649889792863483 | rmse: [0.05744371] | r2 score: [0.99670022]
[I 2023-08-01 19:16:56,151] Trial 87 finished with value: 0.9871385658926699 and parameters: {'learning_rate': 0.06, 'num_epochs': 5, 'initializer': 'Zero', 'num_hidden_units': 10}. Best is trial 58 with value: 0.9871385667925332.
activationfunction1: Sigmoid | activationfunction2: Tanh | hidden layers: 10 | learning rate: 0.03 | iterations: 5 | training loss: 2.2863286693614647e-06 | rmse: [0.00213838] | r2 score: [0.99999543]
activationfunction1: Sigmoid | activationfunction2: Tanh | hidden layers: 10 | learning rate: 0.03 | iterations: 5 | training loss: 0.0017426220297097126 | rmse: [0.05903596] | r2 score: [0.99651476]
activationfunction1: Sigmoid | activationfunction2: Tanh | hidden layers: 10 | learning rate: 0.03 | iterations: 5 | training loss: 0.002232909058651486 | rmse: [0.06682678] | r2 score: [0.99553418]
activationfunction1: Sigmoid | activationfunction2: Tanh | hidden layers: 10 | learning rate: 0.03 | iterations: 5 | training loss: 0.0025144143690851873 | rmse: [0.07091423] | r2 score: [0.99497117]
[I 2023-08-01 19:17:21,606] Trial 88 finished with value: 0.9864665011720741 and parameters: {'learning_rate': 0.03, 'num_epochs': 5, 'initializer': 'Zero', 'num_hidden_units': 10}. Best is trial 58 with value: 0.9871385667925332.
activationfunction1: Sigmoid | activationfunction2: Tanh | hidden layers: 10 | learning rate: 0.03 | iterations: 5 | training loss: 0.0027019939649547955 | rmse: [0.07351182] | r2 score: [0.99459601]
activationfunction1: Sigmoid | activationfunction2: Tanh | hidden layers: 10 | learning rate: 0.06 | iterations: 5 | training loss: 2.8174194729835215e-06 | rmse: [0.00237378] | r2 score: [0.99999437]
activationfunction1: Sigmoid | activationfunction2: Tanh | hidden layers: 10 | learning rate: 0.06 | iterations: 5 | training loss: 0.0012395736980134135 | rmse: [0.04979104] | r2 score: [0.99752085]
activationfunction1: Sigmoid | activationfunction2: Tanh | hidden layers: 10 | learning rate: 0.06 | iterations: 5 | training loss: 0.0014675137069070378 | rmse: [0.05417589] | r2 score: [0.99706497]
activationfunction1: Sigmoid | activationfunction2: Tanh | hidden layers: 10 | learning rate: 0.06 | iterations: 5 | training loss: 0.0015797963461992998 | rmse: [0.05621025] | r2 score: [0.99684041]
[I 2023-08-01 19:17:47,037] Trial 89 finished with value: 0.9871385658926699 and parameters: {'learning_rate': 0.06, 'num_epochs': 5, 'initializer': 'Zero', 'num_hidden_units': 10}. Best is trial 58 with value: 0.9871385667925332.
activationfunction1: Sigmoid | activationfunction2: Tanh | hidden layers: 10 | learning rate: 0.06 | iterations: 5 | training loss: 0.001649889792863483 | rmse: [0.05744371] | r2 score: [0.99670022]
activationfunction1: Sigmoid | activationfunction2: Tanh | hidden layers: 15 | learning rate: 0.06 | iterations: 5 | training loss: 2.8174194729835215e-06 | rmse: [0.00237378] | r2 score: [0.99999437]
activationfunction1: Sigmoid | activationfunction2: Tanh | hidden layers: 15 | learning rate: 0.06 | iterations: 5 | training loss: 0.0012395736980134135 | rmse: [0.04979104] | r2 score: [0.99752085]
activationfunction1: Sigmoid | activationfunction2: Tanh | hidden layers: 15 | learning rate: 0.06 | iterations: 5 | training loss: 0.0014675137069070378 | rmse: [0.05417589] | r2 score: [0.99706497]
activationfunction1: Sigmoid | activationfunction2: Tanh | hidden layers: 15 | learning rate: 0.06 | iterations: 5 | training loss: 0.0015797963461992998 | rmse: [0.05621025] | r2 score: [0.99684041]
activationfunction1: Sigmoid | activationfunction2: Tanh | hidden layers: 15 | learning rate: 0.06 | iterations: 5 | training loss: 0.001649889792863483 | rmse: [0.05744371] | r2 score: [0.99670022]
[I 2023-08-01 19:18:13,080] Trial 90 finished with value: 0.9871385658926699 and parameters: {'learning_rate': 0.06, 'num_epochs': 5, 'initializer': 'Zero', 'num_hidden_units': 15}. Best is trial 58 with value: 0.9871385667925332.
activationfunction1: Sigmoid | activationfunction2: Tanh | hidden layers: 10 | learning rate: 0.06 | iterations: 5 | training loss: 2.8174194729835215e-06 | rmse: [0.00237378] | r2 score: [0.99999437]
activationfunction1: Sigmoid | activationfunction2: Tanh | hidden layers: 10 | learning rate: 0.06 | iterations: 5 | training loss: 0.0012395736980134135 | rmse: [0.04979104] | r2 score: [0.99752085]
activationfunction1: Sigmoid | activationfunction2: Tanh | hidden layers: 10 | learning rate: 0.06 | iterations: 5 | training loss: 0.0014675137069070378 | rmse: [0.05417589] | r2 score: [0.99706497]
activationfunction1: Sigmoid | activationfunction2: Tanh | hidden layers: 10 | learning rate: 0.06 | iterations: 5 | training loss: 0.0015797963461992998 | rmse: [0.05621025] | r2 score: [0.99684041]
activationfunction1: Sigmoid | activationfunction2: Tanh | hidden layers: 10 | learning rate: 0.06 | iterations: 5 | training loss: 0.001649889792863483 | rmse: [0.05744371] | r2 score: [0.99670022]
[I 2023-08-01 19:18:41,204] Trial 91 finished with value: 0.9871385658926699 and parameters: {'learning_rate': 0.06, 'num_epochs': 5, 'initializer': 'Zero', 'num_hidden_units': 10}. Best is trial 58 with value: 0.9871385667925332.
activationfunction1: Sigmoid | activationfunction2: Tanh | hidden layers: 10 | learning rate: 0.06 | iterations: 5 | training loss: 2.8174194729835215e-06 | rmse: [0.00237378] | r2 score: [0.99999437]
activationfunction1: Sigmoid | activationfunction2: Tanh | hidden layers: 10 | learning rate: 0.06 | iterations: 5 | training loss: 0.0012395736980134135 | rmse: [0.04979104] | r2 score: [0.99752085]
activationfunction1: Sigmoid | activationfunction2: Tanh | hidden layers: 10 | learning rate: 0.06 | iterations: 5 | training loss: 0.0014675137069070378 | rmse: [0.05417589] | r2 score: [0.99706497]
activationfunction1: Sigmoid | activationfunction2: Tanh | hidden layers: 10 | learning rate: 0.06 | iterations: 5 | training loss: 0.0015797963461992998 | rmse: [0.05621025] | r2 score: [0.99684041]
activationfunction1: Sigmoid | activationfunction2: Tanh | hidden layers: 10 | learning rate: 0.06 | iterations: 5 | training loss: 0.001649889792863483 | rmse: [0.05744371] | r2 score: [0.99670022]
[I 2023-08-01 19:19:06,017] Trial 92 finished with value: 0.9871385658926699 and parameters: {'learning_rate': 0.06, 'num_epochs': 5, 'initializer': 'Zero', 'num_hidden_units': 10}. Best is trial 58 with value: 0.9871385667925332.
activationfunction1: Sigmoid | activationfunction2: Tanh | hidden layers: 10 | learning rate: 0.06 | iterations: 5 | training loss: 2.8174194729835215e-06 | rmse: [0.00237378] | r2 score: [0.99999437]
activationfunction1: Sigmoid | activationfunction2: Tanh | hidden layers: 10 | learning rate: 0.06 | iterations: 5 | training loss: 0.0012395736980134135 | rmse: [0.04979104] | r2 score: [0.99752085]
activationfunction1: Sigmoid | activationfunction2: Tanh | hidden layers: 10 | learning rate: 0.06 | iterations: 5 | training loss: 0.0014675137069070378 | rmse: [0.05417589] | r2 score: [0.99706497]
activationfunction1: Sigmoid | activationfunction2: Tanh | hidden layers: 10 | learning rate: 0.06 | iterations: 5 | training loss: 0.0015797963461992998 | rmse: [0.05621025] | r2 score: [0.99684041]
[I 2023-08-01 19:19:33,746] Trial 93 finished with value: 0.9871385658926699 and parameters: {'learning_rate': 0.06, 'num_epochs': 5, 'initializer': 'Zero', 'num_hidden_units': 10}. Best is trial 58 with value: 0.9871385667925332.
activationfunction1: Sigmoid | activationfunction2: Tanh | hidden layers: 10 | learning rate: 0.06 | iterations: 5 | training loss: 0.001649889792863483 | rmse: [0.05744371] | r2 score: [0.99670022]
activationfunction1: Sigmoid | activationfunction2: Tanh | hidden layers: 10 | learning rate: 0.06 | iterations: 5 | training loss: 2.8174194729835215e-06 | rmse: [0.00237378] | r2 score: [0.99999437]
activationfunction1: Sigmoid | activationfunction2: Tanh | hidden layers: 10 | learning rate: 0.06 | iterations: 5 | training loss: 0.0012395736980134135 | rmse: [0.04979104] | r2 score: [0.99752085]
activationfunction1: Sigmoid | activationfunction2: Tanh | hidden layers: 10 | learning rate: 0.06 | iterations: 5 | training loss: 0.0014675137069070378 | rmse: [0.05417589] | r2 score: [0.99706497]
activationfunction1: Sigmoid | activationfunction2: Tanh | hidden layers: 10 | learning rate: 0.06 | iterations: 5 | training loss: 0.0015797963461992998 | rmse: [0.05621025] | r2 score: [0.99684041]
activationfunction1: Sigmoid | activationfunction2: Tanh | hidden layers: 10 | learning rate: 0.06 | iterations: 5 | training loss: 0.001649889792863483 | rmse: [0.05744371] | r2 score: [0.99670022]
[I 2023-08-01 19:19:59,972] Trial 94 finished with value: 0.9871385658926699 and parameters: {'learning_rate': 0.06, 'num_epochs': 5, 'initializer': 'Zero', 'num_hidden_units': 10}. Best is trial 58 with value: 0.9871385667925332.
activationfunction1: Sigmoid | activationfunction2: Tanh | hidden layers: 10 | learning rate: 0.06 | iterations: 5 | training loss: 2.8174194729835215e-06 | rmse: [0.00237378] | r2 score: [0.99999437]
activationfunction1: Sigmoid | activationfunction2: Tanh | hidden layers: 10 | learning rate: 0.06 | iterations: 5 | training loss: 0.0012395736980134135 | rmse: [0.04979104] | r2 score: [0.99752085]
activationfunction1: Sigmoid | activationfunction2: Tanh | hidden layers: 10 | learning rate: 0.06 | iterations: 5 | training loss: 0.0014675137069070378 | rmse: [0.05417589] | r2 score: [0.99706497]
activationfunction1: Sigmoid | activationfunction2: Tanh | hidden layers: 10 | learning rate: 0.06 | iterations: 5 | training loss: 0.0015797963461992998 | rmse: [0.05621025] | r2 score: [0.99684041]
