[I 2023-08-01 18:50:30,028] Trial 37 finished with value: 0.9871385218095363 and parameters: {'learning_rate': 0.06, 'num_epochs': 5, 'initializer': 'Xavier', 'num_hidden_units': 15}. Best is trial 26 with value: 0.9871385662349578.
activationfunction1: Sigmoid | activationfunction2: Tanh | hidden layers: 15 | learning rate: 0.06 | iterations: 5 | training loss: 0.0016500029950246187 | rmse: [0.05744568] | r2 score: [0.99669999]
activationfunction1: Sigmoid | activationfunction2: Tanh | hidden layers: 20 | learning rate: 0.01 | iterations: 5 | training loss: 3.419741195444415e-05 | rmse: [0.00827012] | r2 score: [0.99993161]
activationfunction1: Sigmoid | activationfunction2: Tanh | hidden layers: 20 | learning rate: 0.01 | iterations: 5 | training loss: 0.0047071074844723 | rmse: [0.09702688] | r2 score: [0.99058579]
activationfunction1: Sigmoid | activationfunction2: Tanh | hidden layers: 20 | learning rate: 0.01 | iterations: 5 | training loss: 0.006817554346404645 | rmse: [0.11676946] | r2 score: [0.98636489]
activationfunction1: Sigmoid | activationfunction2: Tanh | hidden layers: 20 | learning rate: 0.01 | iterations: 5 | training loss: 0.008133100252410971 | rmse: [0.12753902] | r2 score: [0.9837338]
activationfunction1: Sigmoid | activationfunction2: Tanh | hidden layers: 20 | learning rate: 0.01 | iterations: 5 | training loss: 0.009015137175135858 | rmse: [0.13427685] | r2 score: [0.98196973]
[I 2023-08-01 18:50:56,545] Trial 38 finished with value: 0.9803575516510052 and parameters: {'learning_rate': 0.01, 'num_epochs': 5, 'initializer': 'Xavier', 'num_hidden_units': 20}. Best is trial 26 with value: 0.9871385662349578.
activationfunction1: Sigmoid | activationfunction2: Tanh | hidden layers: 15 | learning rate: 0.06 | iterations: 15 | training loss: 0.0003006504888014458 | rmse: [0.02452144] | r2 score: [0.9993987]
activationfunction1: Sigmoid | activationfunction2: Tanh | hidden layers: 15 | learning rate: 0.06 | iterations: 15 | training loss: 0.0012842598073443978 | rmse: [0.05068057] | r2 score: [0.99743148]
activationfunction1: Sigmoid | activationfunction2: Tanh | hidden layers: 15 | learning rate: 0.06 | iterations: 15 | training loss: 0.0014787217521704242 | rmse: [0.05438238] | r2 score: [0.99704256]
activationfunction1: Sigmoid | activationfunction2: Tanh | hidden layers: 15 | learning rate: 0.06 | iterations: 15 | training loss: 0.0015834361356534517 | rmse: [0.05627497] | r2 score: [0.99683313]
activationfunction1: Sigmoid | activationfunction2: Tanh | hidden layers: 15 | learning rate: 0.06 | iterations: 15 | training loss: 0.0016511271389787149 | rmse: [0.05746524] | r2 score: [0.99669775]
activationfunction1: Sigmoid | activationfunction2: Tanh | hidden layers: 15 | learning rate: 0.06 | iterations: 15 | training loss: 0.0016982821255267426 | rmse: [0.05828005] | r2 score: [0.99660344]
activationfunction1: Sigmoid | activationfunction2: Tanh | hidden layers: 15 | learning rate: 0.06 | iterations: 15 | training loss: 0.001732022361504217 | rmse: [0.05885614] | r2 score: [0.99653596]
activationfunction1: Sigmoid | activationfunction2: Tanh | hidden layers: 15 | learning rate: 0.06 | iterations: 15 | training loss: 0.0017560632873538625 | rmse: [0.0592632] | r2 score: [0.99648787]
activationfunction1: Sigmoid | activationfunction2: Tanh | hidden layers: 15 | learning rate: 0.06 | iterations: 15 | training loss: 0.0017726805148940718 | rmse: [0.05954294] | r2 score: [0.99645464]
activationfunction1: Sigmoid | activationfunction2: Tanh | hidden layers: 15 | learning rate: 0.06 | iterations: 15 | training loss: 0.0017834468324279512 | rmse: [0.05972348] | r2 score: [0.99643311]
activationfunction1: Sigmoid | activationfunction2: Tanh | hidden layers: 15 | learning rate: 0.06 | iterations: 15 | training loss: 0.0017895361994912425 | rmse: [0.05982535] | r2 score: [0.99642093]
activationfunction1: Sigmoid | activationfunction2: Tanh | hidden layers: 15 | learning rate: 0.06 | iterations: 15 | training loss: 0.0017918643879246661 | rmse: [0.05986425] | r2 score: [0.99641627]
activationfunction1: Sigmoid | activationfunction2: Tanh | hidden layers: 15 | learning rate: 0.06 | iterations: 15 | training loss: 0.0017911634705119585 | rmse: [0.05985254] | r2 score: [0.99641767]
activationfunction1: Sigmoid | activationfunction2: Tanh | hidden layers: 15 | learning rate: 0.06 | iterations: 15 | training loss: 0.0017880268500396937 | rmse: [0.05980011] | r2 score: [0.99642395]
activationfunction1: Sigmoid | activationfunction2: Tanh | hidden layers: 15 | learning rate: 0.06 | iterations: 15 | training loss: 0.0017829395104031526 | rmse: [0.05971498] | r2 score: [0.99643412]
[I 2023-08-01 18:52:12,378] Trial 39 finished with value: 0.9870622003193406 and parameters: {'learning_rate': 0.06, 'num_epochs': 15, 'initializer': 'Random', 'num_hidden_units': 15}. Best is trial 26 with value: 0.9871385662349578.
activationfunction1: Sigmoid | activationfunction2: Tanh | hidden layers: 10 | learning rate: 0.03 | iterations: 5 | training loss: 1.700647311438259e-05 | rmse: [0.00583206] | r2 score: [0.99996599]
activationfunction1: Sigmoid | activationfunction2: Tanh | hidden layers: 10 | learning rate: 0.03 | iterations: 5 | training loss: 0.0017457573588313673 | rmse: [0.05908904] | r2 score: [0.99650849]
activationfunction1: Sigmoid | activationfunction2: Tanh | hidden layers: 10 | learning rate: 0.03 | iterations: 5 | training loss: 0.002233830501572456 | rmse: [0.06684057] | r2 score: [0.99553234]
activationfunction1: Sigmoid | activationfunction2: Tanh | hidden layers: 10 | learning rate: 0.03 | iterations: 5 | training loss: 0.0025147437637200133 | rmse: [0.07091888] | r2 score: [0.99497051]
activationfunction1: Sigmoid | activationfunction2: Tanh | hidden layers: 10 | learning rate: 0.03 | iterations: 5 | training loss: 0.0027021163505317157 | rmse: [0.07351349] | r2 score: [0.99459577]
[I 2023-08-01 18:52:38,273] Trial 40 finished with value: 0.9864664392454638 and parameters: {'learning_rate': 0.03, 'num_epochs': 5, 'initializer': 'Xavier', 'num_hidden_units': 10}. Best is trial 26 with value: 0.9871385662349578.
activationfunction1: Sigmoid | activationfunction2: Tanh | hidden layers: 10 | learning rate: 0.06 | iterations: 5 | training loss: 3.41779667975408e-06 | rmse: [0.0026145] | r2 score: [0.99999316]
activationfunction1: Sigmoid | activationfunction2: Tanh | hidden layers: 10 | learning rate: 0.06 | iterations: 5 | training loss: 0.0012396740682560782 | rmse: [0.04979305] | r2 score: [0.99752065]
activationfunction1: Sigmoid | activationfunction2: Tanh | hidden layers: 10 | learning rate: 0.06 | iterations: 5 | training loss: 0.0014675377537683295 | rmse: [0.05417634] | r2 score: [0.99706492]
activationfunction1: Sigmoid | activationfunction2: Tanh | hidden layers: 10 | learning rate: 0.06 | iterations: 5 | training loss: 0.0015798040872585005 | rmse: [0.05621039] | r2 score: [0.99684039]
[I 2023-08-01 18:53:03,168] Trial 41 finished with value: 0.9871385648701705 and parameters: {'learning_rate': 0.06, 'num_epochs': 5, 'initializer': 'Xavier', 'num_hidden_units': 10}. Best is trial 26 with value: 0.9871385662349578.
activationfunction1: Sigmoid | activationfunction2: Tanh | hidden layers: 10 | learning rate: 0.06 | iterations: 5 | training loss: 0.0016498924186988764 | rmse: [0.05744375] | r2 score: [0.99670022]
activationfunction1: Sigmoid | activationfunction2: Tanh | hidden layers: 10 | learning rate: 0.06 | iterations: 5 | training loss: 2.406203744237394e-06 | rmse: [0.00219372] | r2 score: [0.99999519]
activationfunction1: Sigmoid | activationfunction2: Tanh | hidden layers: 10 | learning rate: 0.06 | iterations: 5 | training loss: 0.0012395053804112465 | rmse: [0.04978966] | r2 score: [0.99752099]
activationfunction1: Sigmoid | activationfunction2: Tanh | hidden layers: 10 | learning rate: 0.06 | iterations: 5 | training loss: 0.0014674973155577036 | rmse: [0.05417559] | r2 score: [0.99706501]
activationfunction1: Sigmoid | activationfunction2: Tanh | hidden layers: 10 | learning rate: 0.06 | iterations: 5 | training loss: 0.0015797910697374308 | rmse: [0.05621016] | r2 score: [0.99684042]
[I 2023-08-01 18:53:28,696] Trial 42 finished with value: 0.9871385665896193 and parameters: {'learning_rate': 0.06, 'num_epochs': 5, 'initializer': 'Xavier', 'num_hidden_units': 10}. Best is trial 42 with value: 0.9871385665896193.
activationfunction1: Sigmoid | activationfunction2: Tanh | hidden layers: 10 | learning rate: 0.06 | iterations: 5 | training loss: 0.0016498880030552247 | rmse: [0.05744368] | r2 score: [0.99670022]
activationfunction1: Sigmoid | activationfunction2: Tanh | hidden layers: 10 | learning rate: 0.06 | iterations: 5 | training loss: 2.1849378521963648e-05 | rmse: [0.0066105] | r2 score: [0.9999563]
activationfunction1: Sigmoid | activationfunction2: Tanh | hidden layers: 10 | learning rate: 0.06 | iterations: 5 | training loss: 0.0012427575191457472 | rmse: [0.04985494] | r2 score: [0.99751448]
activationfunction1: Sigmoid | activationfunction2: Tanh | hidden layers: 10 | learning rate: 0.06 | iterations: 5 | training loss: 0.0014682736765416944 | rmse: [0.05418992] | r2 score: [0.99706345]
activationfunction1: Sigmoid | activationfunction2: Tanh | hidden layers: 10 | learning rate: 0.06 | iterations: 5 | training loss: 0.0015800411346268653 | rmse: [0.05621461] | r2 score: [0.99683992]
[I 2023-08-01 18:53:53,379] Trial 43 finished with value: 0.9871385335532861 and parameters: {'learning_rate': 0.06, 'num_epochs': 5, 'initializer': 'Xavier', 'num_hidden_units': 10}. Best is trial 42 with value: 0.9871385665896193.
activationfunction1: Sigmoid | activationfunction2: Tanh | hidden layers: 10 | learning rate: 0.06 | iterations: 5 | training loss: 0.0016499728391165486 | rmse: [0.05744515] | r2 score: [0.99670005]
activationfunction1: Sigmoid | activationfunction2: Tanh | hidden layers: 10 | learning rate: 0.06 | iterations: 5 | training loss: 1.379577476820636e-05 | rmse: [0.00525277] | r2 score: [0.99997241]
activationfunction1: Sigmoid | activationfunction2: Tanh | hidden layers: 10 | learning rate: 0.06 | iterations: 5 | training loss: 0.0012414123149606278 | rmse: [0.04982795] | r2 score: [0.99751718]
activationfunction1: Sigmoid | activationfunction2: Tanh | hidden layers: 10 | learning rate: 0.06 | iterations: 5 | training loss: 0.0014679525323658845 | rmse: [0.05418399] | r2 score: [0.99706409]
activationfunction1: Sigmoid | activationfunction2: Tanh | hidden layers: 10 | learning rate: 0.06 | iterations: 5 | training loss: 0.0015799376572889292 | rmse: [0.05621277] | r2 score: [0.99684012]
[I 2023-08-01 18:54:18,384] Trial 44 finished with value: 0.9871385472253064 and parameters: {'learning_rate': 0.06, 'num_epochs': 5, 'initializer': 'Xavier', 'num_hidden_units': 10}. Best is trial 42 with value: 0.9871385665896193.
activationfunction1: Sigmoid | activationfunction2: Tanh | hidden layers: 10 | learning rate: 0.06 | iterations: 5 | training loss: 0.0016499377306881033 | rmse: [0.05744454] | r2 score: [0.99670012]
activationfunction1: Sigmoid | activationfunction2: Tanh | hidden layers: 15 | learning rate: 0.06 | iterations: 5 | training loss: 9.75022271895533e-06 | rmse: [0.00441593] | r2 score: [0.9999805]
activationfunction1: Sigmoid | activationfunction2: Tanh | hidden layers: 15 | learning rate: 0.06 | iterations: 5 | training loss: 0.0012407343752854232 | rmse: [0.04981434] | r2 score: [0.99751853]
activationfunction1: Sigmoid | activationfunction2: Tanh | hidden layers: 15 | learning rate: 0.06 | iterations: 5 | training loss: 0.001467790865339597 | rmse: [0.05418101] | r2 score: [0.99706442]
activationfunction1: Sigmoid | activationfunction2: Tanh | hidden layers: 15 | learning rate: 0.06 | iterations: 5 | training loss: 0.0015798855856771097 | rmse: [0.05621184] | r2 score: [0.99684023]
activationfunction1: Sigmoid | activationfunction2: Tanh | hidden layers: 15 | learning rate: 0.06 | iterations: 5 | training loss: 0.0016499200651668466 | rmse: [0.05744423] | r2 score: [0.99670016]
[I 2023-08-01 18:54:43,955] Trial 45 finished with value: 0.9871385541044945 and parameters: {'learning_rate': 0.06, 'num_epochs': 5, 'initializer': 'Xavier', 'num_hidden_units': 15}. Best is trial 42 with value: 0.9871385665896193.
activationfunction1: Sigmoid | activationfunction2: Tanh | hidden layers: 10 | learning rate: 0.06 | iterations: 5 | training loss: 4.877817873772525e-06 | rmse: [0.0031234] | r2 score: [0.99999024]
activationfunction1: Sigmoid | activationfunction2: Tanh | hidden layers: 10 | learning rate: 0.06 | iterations: 5 | training loss: 0.0012399184368175025 | rmse: [0.04979796] | r2 score: [0.99752016]
activationfunction1: Sigmoid | activationfunction2: Tanh | hidden layers: 10 | learning rate: 0.06 | iterations: 5 | training loss: 0.0014675961893657347 | rmse: [0.05417741] | r2 score: [0.99706481]
activationfunction1: Sigmoid | activationfunction2: Tanh | hidden layers: 10 | learning rate: 0.06 | iterations: 5 | training loss: 0.0015798228998147967 | rmse: [0.05621073] | r2 score: [0.99684035]
[I 2023-08-01 18:55:08,733] Trial 46 finished with value: 0.9871385623852112 and parameters: {'learning_rate': 0.06, 'num_epochs': 5, 'initializer': 'Xavier', 'num_hidden_units': 10}. Best is trial 42 with value: 0.9871385665896193.
activationfunction1: Sigmoid | activationfunction2: Tanh | hidden layers: 10 | learning rate: 0.06 | iterations: 5 | training loss: 0.0016498988001856854 | rmse: [0.05744386] | r2 score: [0.9967002]
activationfunction1: Sigmoid | activationfunction2: Tanh | hidden layers: 20 | learning rate: 0.06 | iterations: 15 | training loss: 0.0011281019623461954 | rmse: [0.04749952] | r2 score: [0.9977438]
activationfunction1: Sigmoid | activationfunction2: Tanh | hidden layers: 20 | learning rate: 0.06 | iterations: 15 | training loss: 0.001373222588582705 | rmse: [0.05240654] | r2 score: [0.99725355]
activationfunction1: Sigmoid | activationfunction2: Tanh | hidden layers: 20 | learning rate: 0.06 | iterations: 15 | training loss: 0.0015049488086446964 | rmse: [0.05486253] | r2 score: [0.9969901]
activationfunction1: Sigmoid | activationfunction2: Tanh | hidden layers: 20 | learning rate: 0.06 | iterations: 15 | training loss: 0.0015921972218637351 | rmse: [0.05643044] | r2 score: [0.99681561]
activationfunction1: Sigmoid | activationfunction2: Tanh | hidden layers: 20 | learning rate: 0.06 | iterations: 15 | training loss: 0.001654127473765045 | rmse: [0.05751743] | r2 score: [0.99669175]
activationfunction1: Sigmoid | activationfunction2: Tanh | hidden layers: 20 | learning rate: 0.06 | iterations: 15 | training loss: 0.0016993160834876623 | rmse: [0.05829779] | r2 score: [0.99660137]
activationfunction1: Sigmoid | activationfunction2: Tanh | hidden layers: 20 | learning rate: 0.06 | iterations: 15 | training loss: 0.0017323792016787467 | rmse: [0.0588622] | r2 score: [0.99653524]
activationfunction1: Sigmoid | activationfunction2: Tanh | hidden layers: 20 | learning rate: 0.06 | iterations: 15 | training loss: 0.001756186441731796 | rmse: [0.05926527] | r2 score: [0.99648763]
activationfunction1: Sigmoid | activationfunction2: Tanh | hidden layers: 20 | learning rate: 0.06 | iterations: 15 | training loss: 0.0017727229966176012 | rmse: [0.05954365] | r2 score: [0.99645455]
activationfunction1: Sigmoid | activationfunction2: Tanh | hidden layers: 20 | learning rate: 0.06 | iterations: 15 | training loss: 0.0017834614751731834 | rmse: [0.05972372] | r2 score: [0.99643308]
activationfunction1: Sigmoid | activationfunction2: Tanh | hidden layers: 20 | learning rate: 0.06 | iterations: 15 | training loss: 0.0017895412419561682 | rmse: [0.05982543] | r2 score: [0.99642092]
activationfunction1: Sigmoid | activationfunction2: Tanh | hidden layers: 20 | learning rate: 0.06 | iterations: 15 | training loss: 0.0017918661225725101 | rmse: [0.05986428] | r2 score: [0.99641627]
activationfunction1: Sigmoid | activationfunction2: Tanh | hidden layers: 20 | learning rate: 0.06 | iterations: 15 | training loss: 0.0017911640665650638 | rmse: [0.05985255] | r2 score: [0.99641767]
activationfunction1: Sigmoid | activationfunction2: Tanh | hidden layers: 20 | learning rate: 0.06 | iterations: 15 | training loss: 0.0017880270546030137 | rmse: [0.05980012] | r2 score: [0.99642395]
activationfunction1: Sigmoid | activationfunction2: Tanh | hidden layers: 20 | learning rate: 0.06 | iterations: 15 | training loss: 0.0017829395805179725 | rmse: [0.05971498] | r2 score: [0.99643412]
[I 2023-08-01 18:56:27,614] Trial 47 finished with value: 0.9870622002902922 and parameters: {'learning_rate': 0.06, 'num_epochs': 15, 'initializer': 'Random', 'num_hidden_units': 20}. Best is trial 42 with value: 0.9871385665896193.
activationfunction1: Sigmoid | activationfunction2: Tanh | hidden layers: 10 | learning rate: 0.06 | iterations: 5 | training loss: 1.7800660223504962e-05 | rmse: [0.00596668] | r2 score: [0.9999644]
activationfunction1: Sigmoid | activationfunction2: Tanh | hidden layers: 10 | learning rate: 0.06 | iterations: 5 | training loss: 0.0012420821197553099 | rmse: [0.04984139] | r2 score: [0.99751584]
activationfunction1: Sigmoid | activationfunction2: Tanh | hidden layers: 10 | learning rate: 0.06 | iterations: 5 | training loss: 0.0014681123557390777 | rmse: [0.05418694] | r2 score: [0.99706378]
activationfunction1: Sigmoid | activationfunction2: Tanh | hidden layers: 10 | learning rate: 0.06 | iterations: 5 | training loss: 0.0015799891481512631 | rmse: [0.05621368] | r2 score: [0.99684002]
activationfunction1: Sigmoid | activationfunction2: Tanh | hidden layers: 10 | learning rate: 0.06 | iterations: 5 | training loss: 0.0016499552002777619 | rmse: [0.05744484] | r2 score: [0.99670009]
[I 2023-08-01 18:56:52,559] Trial 48 finished with value: 0.9871385404223063 and parameters: {'learning_rate': 0.06, 'num_epochs': 5, 'initializer': 'Xavier', 'num_hidden_units': 10}. Best is trial 42 with value: 0.9871385665896193.
activationfunction1: Sigmoid | activationfunction2: Tanh | hidden layers: 10 | learning rate: 0.01 | iterations: 5 | training loss: 1.938654448503709e-06 | rmse: [0.00196909] | r2 score: [0.99999612]
activationfunction1: Sigmoid | activationfunction2: Tanh | hidden layers: 10 | learning rate: 0.01 | iterations: 5 | training loss: 0.00470136011148247 | rmse: [0.09696762] | r2 score: [0.99059728]
activationfunction1: Sigmoid | activationfunction2: Tanh | hidden layers: 10 | learning rate: 0.01 | iterations: 5 | training loss: 0.006814747461242988 | rmse: [0.11674543] | r2 score: [0.98637051]
activationfunction1: Sigmoid | activationfunction2: Tanh | hidden layers: 10 | learning rate: 0.01 | iterations: 5 | training loss: 0.008132013263732503 | rmse: [0.1275305] | r2 score: [0.98373597]
activationfunction1: Sigmoid | activationfunction2: Tanh | hidden layers: 10 | learning rate: 0.01 | iterations: 5 | training loss: 0.009014706933551737 | rmse: [0.13427365] | r2 score: [0.98197059]
[I 2023-08-01 18:57:17,451] Trial 49 finished with value: 0.9803579880077185 and parameters: {'learning_rate': 0.01, 'num_epochs': 5, 'initializer': 'Zero', 'num_hidden_units': 10}. Best is trial 42 with value: 0.9871385665896193.
activationfunction1: Sigmoid | activationfunction2: Tanh | hidden layers: 10 | learning rate: 0.06 | iterations: 10 | training loss: 2.5055068166093904e-06 | rmse: [0.00223853] | r2 score: [0.99999499]
activationfunction1: Sigmoid | activationfunction2: Tanh | hidden layers: 10 | learning rate: 0.06 | iterations: 10 | training loss: 0.0012395218128994513 | rmse: [0.04978999] | r2 score: [0.99752096]
activationfunction1: Sigmoid | activationfunction2: Tanh | hidden layers: 10 | learning rate: 0.06 | iterations: 10 | training loss: 0.001467501260302941 | rmse: [0.05417566] | r2 score: [0.997065]
activationfunction1: Sigmoid | activationfunction2: Tanh | hidden layers: 10 | learning rate: 0.06 | iterations: 10 | training loss: 0.0015797923395592414 | rmse: [0.05621018] | r2 score: [0.99684042]
activationfunction1: Sigmoid | activationfunction2: Tanh | hidden layers: 10 | learning rate: 0.06 | iterations: 10 | training loss: 0.001649888433785546 | rmse: [0.05744369] | r2 score: [0.99670022]
activationfunction1: Sigmoid | activationfunction2: Tanh | hidden layers: 10 | learning rate: 0.06 | iterations: 10 | training loss: 0.0016978561865382963 | rmse: [0.05827274] | r2 score: [0.99660429]
activationfunction1: Sigmoid | activationfunction2: Tanh | hidden layers: 10 | learning rate: 0.06 | iterations: 10 | training loss: 0.0017318754631146952 | rmse: [0.05885364] | r2 score: [0.99653625]
activationfunction1: Sigmoid | activationfunction2: Tanh | hidden layers: 10 | learning rate: 0.06 | iterations: 10 | training loss: 0.0017560126005264041 | rmse: [0.05926234] | r2 score: [0.99648797]
activationfunction1: Sigmoid | activationfunction2: Tanh | hidden layers: 10 | learning rate: 0.06 | iterations: 10 | training loss: 0.0017726630319372663 | rmse: [0.05954264] | r2 score: [0.99645467]
