[I 2023-08-01 19:05:01,825] Trial 65 finished with value: 0.9871385316764081 and parameters: {'learning_rate': 0.06, 'num_epochs': 5, 'initializer': 'Xavier', 'num_hidden_units': 10}. Best is trial 58 with value: 0.9871385667925332.
activationfunction1: Sigmoid | activationfunction2: Tanh | hidden layers: 20 | learning rate: 0.06 | iterations: 15 | training loss: 2.8174194729835215e-06 | rmse: [0.00237378] | r2 score: [0.99999437]
activationfunction1: Sigmoid | activationfunction2: Tanh | hidden layers: 20 | learning rate: 0.06 | iterations: 15 | training loss: 0.0012395736980134135 | rmse: [0.04979104] | r2 score: [0.99752085]
activationfunction1: Sigmoid | activationfunction2: Tanh | hidden layers: 20 | learning rate: 0.06 | iterations: 15 | training loss: 0.0014675137069070378 | rmse: [0.05417589] | r2 score: [0.99706497]
activationfunction1: Sigmoid | activationfunction2: Tanh | hidden layers: 20 | learning rate: 0.06 | iterations: 15 | training loss: 0.0015797963461992998 | rmse: [0.05621025] | r2 score: [0.99684041]
activationfunction1: Sigmoid | activationfunction2: Tanh | hidden layers: 20 | learning rate: 0.06 | iterations: 15 | training loss: 0.001649889792863483 | rmse: [0.05744371] | r2 score: [0.99670022]
activationfunction1: Sigmoid | activationfunction2: Tanh | hidden layers: 20 | learning rate: 0.06 | iterations: 15 | training loss: 0.0016978566535677778 | rmse: [0.05827275] | r2 score: [0.99660429]
activationfunction1: Sigmoid | activationfunction2: Tanh | hidden layers: 20 | learning rate: 0.06 | iterations: 15 | training loss: 0.001731875624151819 | rmse: [0.05885364] | r2 score: [0.99653625]
activationfunction1: Sigmoid | activationfunction2: Tanh | hidden layers: 20 | learning rate: 0.06 | iterations: 15 | training loss: 0.0017560126560881 | rmse: [0.05926234] | r2 score: [0.99648797]
activationfunction1: Sigmoid | activationfunction2: Tanh | hidden layers: 20 | learning rate: 0.06 | iterations: 15 | training loss: 0.0017726630511012496 | rmse: [0.05954264] | r2 score: [0.99645467]
activationfunction1: Sigmoid | activationfunction2: Tanh | hidden layers: 20 | learning rate: 0.06 | iterations: 15 | training loss: 0.0017834408130994628 | rmse: [0.05972338] | r2 score: [0.99643312]
activationfunction1: Sigmoid | activationfunction2: Tanh | hidden layers: 20 | learning rate: 0.06 | iterations: 15 | training loss: 0.0017895341266562388 | rmse: [0.05982532] | r2 score: [0.99642093]
activationfunction1: Sigmoid | activationfunction2: Tanh | hidden layers: 20 | learning rate: 0.06 | iterations: 15 | training loss: 0.0017918636748550842 | rmse: [0.05986424] | r2 score: [0.99641627]
activationfunction1: Sigmoid | activationfunction2: Tanh | hidden layers: 20 | learning rate: 0.06 | iterations: 15 | training loss: 0.0017911632254899422 | rmse: [0.05985254] | r2 score: [0.99641767]
activationfunction1: Sigmoid | activationfunction2: Tanh | hidden layers: 20 | learning rate: 0.06 | iterations: 15 | training loss: 0.0017880267659490209 | rmse: [0.05980011] | r2 score: [0.99642395]
[I 2023-08-01 19:06:21,937] Trial 66 finished with value: 0.9870622003312817 and parameters: {'learning_rate': 0.06, 'num_epochs': 15, 'initializer': 'Zero', 'num_hidden_units': 20}. Best is trial 58 with value: 0.9871385667925332.
activationfunction1: Sigmoid | activationfunction2: Tanh | hidden layers: 20 | learning rate: 0.06 | iterations: 15 | training loss: 0.0017829394815807812 | rmse: [0.05971498] | r2 score: [0.99643412]
activationfunction1: Sigmoid | activationfunction2: Tanh | hidden layers: 10 | learning rate: 0.06 | iterations: 5 | training loss: 0.0001826738278191872 | rmse: [0.01911407] | r2 score: [0.99963465]
activationfunction1: Sigmoid | activationfunction2: Tanh | hidden layers: 10 | learning rate: 0.06 | iterations: 5 | training loss: 0.0012678092236718867 | rmse: [0.05035492] | r2 score: [0.99746438]
activationfunction1: Sigmoid | activationfunction2: Tanh | hidden layers: 10 | learning rate: 0.06 | iterations: 5 | training loss: 0.0014744475841882818 | rmse: [0.05430373] | r2 score: [0.9970511]
activationfunction1: Sigmoid | activationfunction2: Tanh | hidden layers: 10 | learning rate: 0.06 | iterations: 5 | training loss: 0.0015820406286694538 | rmse: [0.05625017] | r2 score: [0.99683592]
[I 2023-08-01 19:06:47,442] Trial 67 finished with value: 0.9871382689471868 and parameters: {'learning_rate': 0.06, 'num_epochs': 5, 'initializer': 'Random', 'num_hidden_units': 10}. Best is trial 58 with value: 0.9871385667925332.
activationfunction1: Sigmoid | activationfunction2: Tanh | hidden layers: 10 | learning rate: 0.06 | iterations: 5 | training loss: 0.0016506520982905847 | rmse: [0.05745698] | r2 score: [0.9966987]
activationfunction1: Sigmoid | activationfunction2: Tanh | hidden layers: 10 | learning rate: 0.06 | iterations: 5 | training loss: 1.0843525427091948e-05 | rmse: [0.00465694] | r2 score: [0.99997831]
activationfunction1: Sigmoid | activationfunction2: Tanh | hidden layers: 10 | learning rate: 0.06 | iterations: 5 | training loss: 0.001240917657198998 | rmse: [0.04981802] | r2 score: [0.99751816]
activationfunction1: Sigmoid | activationfunction2: Tanh | hidden layers: 10 | learning rate: 0.06 | iterations: 5 | training loss: 0.0014678345685237063 | rmse: [0.05418181] | r2 score: [0.99706433]
activationfunction1: Sigmoid | activationfunction2: Tanh | hidden layers: 10 | learning rate: 0.06 | iterations: 5 | training loss: 0.001579899660799037 | rmse: [0.05621209] | r2 score: [0.9968402]
activationfunction1: Sigmoid | activationfunction2: Tanh | hidden layers: 10 | learning rate: 0.06 | iterations: 5 | training loss: 0.0016499248401039602 | rmse: [0.05744432] | r2 score: [0.99670015]
[I 2023-08-01 19:07:14,794] Trial 68 finished with value: 0.9871385522450817 and parameters: {'learning_rate': 0.06, 'num_epochs': 5, 'initializer': 'Xavier', 'num_hidden_units': 10}. Best is trial 58 with value: 0.9871385667925332.
activationfunction1: Sigmoid | activationfunction2: Tanh | hidden layers: 10 | learning rate: 0.03 | iterations: 5 | training loss: 9.031176765845546e-07 | rmse: [0.00134396] | r2 score: [0.99999819]
activationfunction1: Sigmoid | activationfunction2: Tanh | hidden layers: 10 | learning rate: 0.03 | iterations: 5 | training loss: 0.0017423574505185816 | rmse: [0.05903148] | r2 score: [0.99651529]
activationfunction1: Sigmoid | activationfunction2: Tanh | hidden layers: 10 | learning rate: 0.03 | iterations: 5 | training loss: 0.0022328263813310404 | rmse: [0.06682554] | r2 score: [0.99553435]
activationfunction1: Sigmoid | activationfunction2: Tanh | hidden layers: 10 | learning rate: 0.03 | iterations: 5 | training loss: 0.0025143848222913185 | rmse: [0.07091382] | r2 score: [0.99497123]
activationfunction1: Sigmoid | activationfunction2: Tanh | hidden layers: 10 | learning rate: 0.03 | iterations: 5 | training loss: 0.0027019829877413656 | rmse: [0.07351168] | r2 score: [0.99459603]
[I 2023-08-01 19:07:40,160] Trial 69 finished with value: 0.9864665067263966 and parameters: {'learning_rate': 0.03, 'num_epochs': 5, 'initializer': 'Xavier', 'num_hidden_units': 10}. Best is trial 58 with value: 0.9871385667925332.
activationfunction1: Sigmoid | activationfunction2: Tanh | hidden layers: 15 | learning rate: 0.06 | iterations: 5 | training loss: 6.769908106695568e-06 | rmse: [0.00367965] | r2 score: [0.99998646]
activationfunction1: Sigmoid | activationfunction2: Tanh | hidden layers: 15 | learning rate: 0.06 | iterations: 5 | training loss: 0.0012402347817648972 | rmse: [0.04980431] | r2 score: [0.99751953]
activationfunction1: Sigmoid | activationfunction2: Tanh | hidden layers: 15 | learning rate: 0.06 | iterations: 5 | training loss: 0.0014676717106817934 | rmse: [0.05417881] | r2 score: [0.99706466]
activationfunction1: Sigmoid | activationfunction2: Tanh | hidden layers: 15 | learning rate: 0.06 | iterations: 5 | training loss: 0.0015798472154647302 | rmse: [0.05621116] | r2 score: [0.99684031]
activationfunction1: Sigmoid | activationfunction2: Tanh | hidden layers: 15 | learning rate: 0.06 | iterations: 5 | training loss: 0.0016499070486145893 | rmse: [0.05744401] | r2 score: [0.99670019]
[I 2023-08-01 19:08:07,079] Trial 70 finished with value: 0.9871385591732407 and parameters: {'learning_rate': 0.06, 'num_epochs': 5, 'initializer': 'Xavier', 'num_hidden_units': 15}. Best is trial 58 with value: 0.9871385667925332.
activationfunction1: Sigmoid | activationfunction2: Tanh | hidden layers: 10 | learning rate: 0.06 | iterations: 5 | training loss: 2.7198964949798284e-05 | rmse: [0.0073755] | r2 score: [0.9999456]
activationfunction1: Sigmoid | activationfunction2: Tanh | hidden layers: 10 | learning rate: 0.06 | iterations: 5 | training loss: 0.0012436468445030779 | rmse: [0.04987277] | r2 score: [0.99751271]
activationfunction1: Sigmoid | activationfunction2: Tanh | hidden layers: 10 | learning rate: 0.06 | iterations: 5 | training loss: 0.0014684864016833907 | rmse: [0.05419384] | r2 score: [0.99706303]
activationfunction1: Sigmoid | activationfunction2: Tanh | hidden layers: 10 | learning rate: 0.06 | iterations: 5 | training loss: 0.001580109706659834 | rmse: [0.05621583] | r2 score: [0.99683978]
activationfunction1: Sigmoid | activationfunction2: Tanh | hidden layers: 10 | learning rate: 0.06 | iterations: 5 | training loss: 0.0016499961070697384 | rmse: [0.05744556] | r2 score: [0.99670001]
[I 2023-08-01 19:08:34,381] Trial 71 finished with value: 0.987138524491972 and parameters: {'learning_rate': 0.06, 'num_epochs': 5, 'initializer': 'Xavier', 'num_hidden_units': 10}. Best is trial 58 with value: 0.9871385667925332.
activationfunction1: Sigmoid | activationfunction2: Tanh | hidden layers: 10 | learning rate: 0.06 | iterations: 5 | training loss: 1.8774737026627026e-05 | rmse: [0.00612776] | r2 score: [0.99996245]
activationfunction1: Sigmoid | activationfunction2: Tanh | hidden layers: 10 | learning rate: 0.06 | iterations: 5 | training loss: 0.0012422447862371882 | rmse: [0.04984465] | r2 score: [0.99751551]
activationfunction1: Sigmoid | activationfunction2: Tanh | hidden layers: 10 | learning rate: 0.06 | iterations: 5 | training loss: 0.001468151192434281 | rmse: [0.05418766] | r2 score: [0.9970637]
activationfunction1: Sigmoid | activationfunction2: Tanh | hidden layers: 10 | learning rate: 0.06 | iterations: 5 | training loss: 0.0015800016622700363 | rmse: [0.05621391] | r2 score: [0.99684]
activationfunction1: Sigmoid | activationfunction2: Tanh | hidden layers: 10 | learning rate: 0.06 | iterations: 5 | training loss: 0.0016499594461757926 | rmse: [0.05744492] | r2 score: [0.99670008]
[I 2023-08-01 19:09:00,043] Trial 72 finished with value: 0.9871385387688539 and parameters: {'learning_rate': 0.06, 'num_epochs': 5, 'initializer': 'Xavier', 'num_hidden_units': 10}. Best is trial 58 with value: 0.9871385667925332.
activationfunction1: Sigmoid | activationfunction2: Tanh | hidden layers: 10 | learning rate: 0.06 | iterations: 5 | training loss: 2.518881587233303e-06 | rmse: [0.0022445] | r2 score: [0.99999496]
activationfunction1: Sigmoid | activationfunction2: Tanh | hidden layers: 10 | learning rate: 0.06 | iterations: 5 | training loss: 0.0012395240327183377 | rmse: [0.04979004] | r2 score: [0.99752095]
activationfunction1: Sigmoid | activationfunction2: Tanh | hidden layers: 10 | learning rate: 0.06 | iterations: 5 | training loss: 0.001467501793077438 | rmse: [0.05417567] | r2 score: [0.997065]
activationfunction1: Sigmoid | activationfunction2: Tanh | hidden layers: 10 | learning rate: 0.06 | iterations: 5 | training loss: 0.0015797925110610862 | rmse: [0.05621019] | r2 score: [0.99684041]
[I 2023-08-01 19:09:26,680] Trial 73 finished with value: 0.9871385663992405 and parameters: {'learning_rate': 0.06, 'num_epochs': 5, 'initializer': 'Xavier', 'num_hidden_units': 10}. Best is trial 58 with value: 0.9871385667925332.
activationfunction1: Sigmoid | activationfunction2: Tanh | hidden layers: 10 | learning rate: 0.06 | iterations: 5 | training loss: 0.0016498884919599298 | rmse: [0.05744369] | r2 score: [0.99670022]
activationfunction1: Sigmoid | activationfunction2: Tanh | hidden layers: 10 | learning rate: 0.06 | iterations: 5 | training loss: 7.283340265453233e-06 | rmse: [0.00381663] | r2 score: [0.99998543]
activationfunction1: Sigmoid | activationfunction2: Tanh | hidden layers: 10 | learning rate: 0.06 | iterations: 5 | training loss: 0.0012403208143192536 | rmse: [0.04980604] | r2 score: [0.99751936]
activationfunction1: Sigmoid | activationfunction2: Tanh | hidden layers: 10 | learning rate: 0.06 | iterations: 5 | training loss: 0.001467692235941237 | rmse: [0.05417919] | r2 score: [0.99706462]
activationfunction1: Sigmoid | activationfunction2: Tanh | hidden layers: 10 | learning rate: 0.06 | iterations: 5 | training loss: 0.001579853824498499 | rmse: [0.05621128] | r2 score: [0.99684029]
activationfunction1: Sigmoid | activationfunction2: Tanh | hidden layers: 10 | learning rate: 0.06 | iterations: 5 | training loss: 0.0016499092905929746 | rmse: [0.05744405] | r2 score: [0.99670018]
[I 2023-08-01 19:09:53,478] Trial 74 finished with value: 0.9871385583002014 and parameters: {'learning_rate': 0.06, 'num_epochs': 5, 'initializer': 'Xavier', 'num_hidden_units': 10}. Best is trial 58 with value: 0.9871385667925332.
activationfunction1: Sigmoid | activationfunction2: Tanh | hidden layers: 10 | learning rate: 0.06 | iterations: 10 | training loss: 1.3442434339949546e-05 | rmse: [0.00518506] | r2 score: [0.99997312]
activationfunction1: Sigmoid | activationfunction2: Tanh | hidden layers: 10 | learning rate: 0.06 | iterations: 10 | training loss: 0.0012413531186188857 | rmse: [0.04982676] | r2 score: [0.99751729]
activationfunction1: Sigmoid | activationfunction2: Tanh | hidden layers: 10 | learning rate: 0.06 | iterations: 10 | training loss: 0.0014679384133349698 | rmse: [0.05418373] | r2 score: [0.99706412]
activationfunction1: Sigmoid | activationfunction2: Tanh | hidden layers: 10 | learning rate: 0.06 | iterations: 10 | training loss: 0.0015799331091356742 | rmse: [0.05621269] | r2 score: [0.99684013]
activationfunction1: Sigmoid | activationfunction2: Tanh | hidden layers: 10 | learning rate: 0.06 | iterations: 10 | training loss: 0.0016499361876631008 | rmse: [0.05744452] | r2 score: [0.99670013]
activationfunction1: Sigmoid | activationfunction2: Tanh | hidden layers: 10 | learning rate: 0.06 | iterations: 10 | training loss: 0.0016978725969343407 | rmse: [0.05827302] | r2 score: [0.99660425]
activationfunction1: Sigmoid | activationfunction2: Tanh | hidden layers: 10 | learning rate: 0.06 | iterations: 10 | training loss: 0.001731881121650792 | rmse: [0.05885374] | r2 score: [0.99653624]
activationfunction1: Sigmoid | activationfunction2: Tanh | hidden layers: 10 | learning rate: 0.06 | iterations: 10 | training loss: 0.0017560145528628648 | rmse: [0.05926238] | r2 score: [0.99648797]
activationfunction1: Sigmoid | activationfunction2: Tanh | hidden layers: 10 | learning rate: 0.06 | iterations: 10 | training loss: 0.0017726637053252059 | rmse: [0.05954265] | r2 score: [0.99645467]
[I 2023-08-01 19:10:45,088] Trial 75 finished with value: 0.9870613415995965 and parameters: {'learning_rate': 0.06, 'num_epochs': 10, 'initializer': 'Xavier', 'num_hidden_units': 10}. Best is trial 58 with value: 0.9871385667925332.
activationfunction1: Sigmoid | activationfunction2: Tanh | hidden layers: 10 | learning rate: 0.06 | iterations: 10 | training loss: 0.0017834410385923474 | rmse: [0.05972338] | r2 score: [0.99643312]
activationfunction1: Sigmoid | activationfunction2: Tanh | hidden layers: 10 | learning rate: 0.01 | iterations: 5 | training loss: 1.537510714243043e-05 | rmse: [0.00554529] | r2 score: [0.99996925]
activationfunction1: Sigmoid | activationfunction2: Tanh | hidden layers: 10 | learning rate: 0.01 | iterations: 5 | training loss: 0.004702472675801749 | rmse: [0.0969791] | r2 score: [0.99059505]
activationfunction1: Sigmoid | activationfunction2: Tanh | hidden layers: 10 | learning rate: 0.01 | iterations: 5 | training loss: 0.006815663448933663 | rmse: [0.11675327] | r2 score: [0.98636867]
activationfunction1: Sigmoid | activationfunction2: Tanh | hidden layers: 10 | learning rate: 0.01 | iterations: 5 | training loss: 0.008132367953115793 | rmse: [0.12753327] | r2 score: [0.98373526]
activationfunction1: Sigmoid | activationfunction2: Tanh | hidden layers: 10 | learning rate: 0.01 | iterations: 5 | training loss: 0.00901484731902734 | rmse: [0.1342747] | r2 score: [0.98197031]
[I 2023-08-01 19:11:10,548] Trial 76 finished with value: 0.9803578456294711 and parameters: {'learning_rate': 0.01, 'num_epochs': 5, 'initializer': 'Xavier', 'num_hidden_units': 10}. Best is trial 58 with value: 0.9871385667925332.
activationfunction1: Sigmoid | activationfunction2: Tanh | hidden layers: 10 | learning rate: 0.06 | iterations: 5 | training loss: 2.8174194729835215e-06 | rmse: [0.00237378] | r2 score: [0.99999437]
activationfunction1: Sigmoid | activationfunction2: Tanh | hidden layers: 10 | learning rate: 0.06 | iterations: 5 | training loss: 0.0012395736980134135 | rmse: [0.04979104] | r2 score: [0.99752085]
activationfunction1: Sigmoid | activationfunction2: Tanh | hidden layers: 10 | learning rate: 0.06 | iterations: 5 | training loss: 0.0014675137069070378 | rmse: [0.05417589] | r2 score: [0.99706497]
activationfunction1: Sigmoid | activationfunction2: Tanh | hidden layers: 10 | learning rate: 0.06 | iterations: 5 | training loss: 0.0015797963461992998 | rmse: [0.05621025] | r2 score: [0.99684041]
[I 2023-08-01 19:11:35,764] Trial 77 finished with value: 0.9871385658926699 and parameters: {'learning_rate': 0.06, 'num_epochs': 5, 'initializer': 'Zero', 'num_hidden_units': 10}. Best is trial 58 with value: 0.9871385667925332.
activationfunction1: Sigmoid | activationfunction2: Tanh | hidden layers: 10 | learning rate: 0.06 | iterations: 5 | training loss: 0.001649889792863483 | rmse: [0.05744371] | r2 score: [0.99670022]
activationfunction1: Sigmoid | activationfunction2: Tanh | hidden layers: 20 | learning rate: 0.06 | iterations: 15 | training loss: 2.8174194729835215e-06 | rmse: [0.00237378] | r2 score: [0.99999437]
activationfunction1: Sigmoid | activationfunction2: Tanh | hidden layers: 20 | learning rate: 0.06 | iterations: 15 | training loss: 0.0012395736980134135 | rmse: [0.04979104] | r2 score: [0.99752085]
activationfunction1: Sigmoid | activationfunction2: Tanh | hidden layers: 20 | learning rate: 0.06 | iterations: 15 | training loss: 0.0014675137069070378 | rmse: [0.05417589] | r2 score: [0.99706497]
activationfunction1: Sigmoid | activationfunction2: Tanh | hidden layers: 20 | learning rate: 0.06 | iterations: 15 | training loss: 0.0015797963461992998 | rmse: [0.05621025] | r2 score: [0.99684041]
activationfunction1: Sigmoid | activationfunction2: Tanh | hidden layers: 20 | learning rate: 0.06 | iterations: 15 | training loss: 0.001649889792863483 | rmse: [0.05744371] | r2 score: [0.99670022]
activationfunction1: Sigmoid | activationfunction2: Tanh | hidden layers: 20 | learning rate: 0.06 | iterations: 15 | training loss: 0.0016978566535677778 | rmse: [0.05827275] | r2 score: [0.99660429]
activationfunction1: Sigmoid | activationfunction2: Tanh | hidden layers: 20 | learning rate: 0.06 | iterations: 15 | training loss: 0.001731875624151819 | rmse: [0.05885364] | r2 score: [0.99653625]
activationfunction1: Sigmoid | activationfunction2: Tanh | hidden layers: 20 | learning rate: 0.06 | iterations: 15 | training loss: 0.0017560126560881 | rmse: [0.05926234] | r2 score: [0.99648797]
activationfunction1: Sigmoid | activationfunction2: Tanh | hidden layers: 20 | learning rate: 0.06 | iterations: 15 | training loss: 0.0017726630511012496 | rmse: [0.05954264] | r2 score: [0.99645467]
activationfunction1: Sigmoid | activationfunction2: Tanh | hidden layers: 20 | learning rate: 0.06 | iterations: 15 | training loss: 0.0017834408130994628 | rmse: [0.05972338] | r2 score: [0.99643312]
activationfunction1: Sigmoid | activationfunction2: Tanh | hidden layers: 20 | learning rate: 0.06 | iterations: 15 | training loss: 0.0017895341266562388 | rmse: [0.05982532] | r2 score: [0.99642093]
activationfunction1: Sigmoid | activationfunction2: Tanh | hidden layers: 20 | learning rate: 0.06 | iterations: 15 | training loss: 0.0017918636748550842 | rmse: [0.05986424] | r2 score: [0.99641627]
activationfunction1: Sigmoid | activationfunction2: Tanh | hidden layers: 20 | learning rate: 0.06 | iterations: 15 | training loss: 0.0017911632254899422 | rmse: [0.05985254] | r2 score: [0.99641767]
activationfunction1: Sigmoid | activationfunction2: Tanh | hidden layers: 20 | learning rate: 0.06 | iterations: 15 | training loss: 0.0017880267659490209 | rmse: [0.05980011] | r2 score: [0.99642395]
activationfunction1: Sigmoid | activationfunction2: Tanh | hidden layers: 20 | learning rate: 0.06 | iterations: 15 | training loss: 0.0017829394815807812 | rmse: [0.05971498] | r2 score: [0.99643412]
