[I 2023-08-01 19:20:25,419] Trial 95 finished with value: 0.9871385658926699 and parameters: {'learning_rate': 0.06, 'num_epochs': 5, 'initializer': 'Zero', 'num_hidden_units': 10}. Best is trial 58 with value: 0.9871385667925332.
activationfunction1: Sigmoid | activationfunction2: Tanh | hidden layers: 10 | learning rate: 0.06 | iterations: 5 | training loss: 0.001649889792863483 | rmse: [0.05744371] | r2 score: [0.99670022]
activationfunction1: Sigmoid | activationfunction2: Tanh | hidden layers: 10 | learning rate: 0.01 | iterations: 10 | training loss: 1.938654448503709e-06 | rmse: [0.00196909] | r2 score: [0.99999612]
activationfunction1: Sigmoid | activationfunction2: Tanh | hidden layers: 10 | learning rate: 0.01 | iterations: 10 | training loss: 0.00470136011148247 | rmse: [0.09696762] | r2 score: [0.99059728]
activationfunction1: Sigmoid | activationfunction2: Tanh | hidden layers: 10 | learning rate: 0.01 | iterations: 10 | training loss: 0.006814747461242988 | rmse: [0.11674543] | r2 score: [0.98637051]
activationfunction1: Sigmoid | activationfunction2: Tanh | hidden layers: 10 | learning rate: 0.01 | iterations: 10 | training loss: 0.008132013263732503 | rmse: [0.1275305] | r2 score: [0.98373597]
activationfunction1: Sigmoid | activationfunction2: Tanh | hidden layers: 10 | learning rate: 0.01 | iterations: 10 | training loss: 0.009014706933551737 | rmse: [0.13427365] | r2 score: [0.98197059]
activationfunction1: Sigmoid | activationfunction2: Tanh | hidden layers: 10 | learning rate: 0.01 | iterations: 10 | training loss: 0.00962533015650443 | rmse: [0.13874675] | r2 score: [0.98074934]
activationfunction1: Sigmoid | activationfunction2: Tanh | hidden layers: 10 | learning rate: 0.01 | iterations: 10 | training loss: 0.010052947856818432 | rmse: [0.14179526] | r2 score: [0.9798941]
activationfunction1: Sigmoid | activationfunction2: Tanh | hidden layers: 10 | learning rate: 0.01 | iterations: 10 | training loss: 0.010350837027717026 | rmse: [0.14388077] | r2 score: [0.97929833]
activationfunction1: Sigmoid | activationfunction2: Tanh | hidden layers: 10 | learning rate: 0.01 | iterations: 10 | training loss: 0.0105530970877236 | rmse: [0.1452797] | r2 score: [0.97889381]
activationfunction1: Sigmoid | activationfunction2: Tanh | hidden layers: 10 | learning rate: 0.01 | iterations: 10 | training loss: 0.010682817776929846 | rmse: [0.14616989] | r2 score: [0.97863436]
[I 2023-08-01 19:21:15,449] Trial 96 finished with value: 0.9780025366523848 and parameters: {'learning_rate': 0.01, 'num_epochs': 10, 'initializer': 'Zero', 'num_hidden_units': 10}. Best is trial 58 with value: 0.9871385667925332.
activationfunction1: Sigmoid | activationfunction2: Tanh | hidden layers: 10 | learning rate: 0.06 | iterations: 5 | training loss: 2.8174194729835215e-06 | rmse: [0.00237378] | r2 score: [0.99999437]
activationfunction1: Sigmoid | activationfunction2: Tanh | hidden layers: 10 | learning rate: 0.06 | iterations: 5 | training loss: 0.0012395736980134135 | rmse: [0.04979104] | r2 score: [0.99752085]
activationfunction1: Sigmoid | activationfunction2: Tanh | hidden layers: 10 | learning rate: 0.06 | iterations: 5 | training loss: 0.0014675137069070378 | rmse: [0.05417589] | r2 score: [0.99706497]
activationfunction1: Sigmoid | activationfunction2: Tanh | hidden layers: 10 | learning rate: 0.06 | iterations: 5 | training loss: 0.0015797963461992998 | rmse: [0.05621025] | r2 score: [0.99684041]
activationfunction1: Sigmoid | activationfunction2: Tanh | hidden layers: 10 | learning rate: 0.06 | iterations: 5 | training loss: 0.001649889792863483 | rmse: [0.05744371] | r2 score: [0.99670022]
[I 2023-08-01 19:21:41,918] Trial 97 finished with value: 0.9871385658926699 and parameters: {'learning_rate': 0.06, 'num_epochs': 5, 'initializer': 'Zero', 'num_hidden_units': 10}. Best is trial 58 with value: 0.9871385667925332.
activationfunction1: Sigmoid | activationfunction2: Tanh | hidden layers: 10 | learning rate: 0.06 | iterations: 5 | training loss: 2.8174194729835215e-06 | rmse: [0.00237378] | r2 score: [0.99999437]
activationfunction1: Sigmoid | activationfunction2: Tanh | hidden layers: 10 | learning rate: 0.06 | iterations: 5 | training loss: 0.0012395736980134135 | rmse: [0.04979104] | r2 score: [0.99752085]
activationfunction1: Sigmoid | activationfunction2: Tanh | hidden layers: 10 | learning rate: 0.06 | iterations: 5 | training loss: 0.0014675137069070378 | rmse: [0.05417589] | r2 score: [0.99706497]
activationfunction1: Sigmoid | activationfunction2: Tanh | hidden layers: 10 | learning rate: 0.06 | iterations: 5 | training loss: 0.0015797963461992998 | rmse: [0.05621025] | r2 score: [0.99684041]
activationfunction1: Sigmoid | activationfunction2: Tanh | hidden layers: 10 | learning rate: 0.06 | iterations: 5 | training loss: 0.001649889792863483 | rmse: [0.05744371] | r2 score: [0.99670022]
[I 2023-08-01 19:22:07,996] Trial 98 finished with value: 0.9871385658926699 and parameters: {'learning_rate': 0.06, 'num_epochs': 5, 'initializer': 'Zero', 'num_hidden_units': 10}. Best is trial 58 with value: 0.9871385667925332.
activationfunction1: Sigmoid | activationfunction2: Tanh | hidden layers: 20 | learning rate: 0.06 | iterations: 15 | training loss: 2.8174194729835215e-06 | rmse: [0.00237378] | r2 score: [0.99999437]
activationfunction1: Sigmoid | activationfunction2: Tanh | hidden layers: 20 | learning rate: 0.06 | iterations: 15 | training loss: 0.0012395736980134135 | rmse: [0.04979104] | r2 score: [0.99752085]
activationfunction1: Sigmoid | activationfunction2: Tanh | hidden layers: 20 | learning rate: 0.06 | iterations: 15 | training loss: 0.0014675137069070378 | rmse: [0.05417589] | r2 score: [0.99706497]
activationfunction1: Sigmoid | activationfunction2: Tanh | hidden layers: 20 | learning rate: 0.06 | iterations: 15 | training loss: 0.0015797963461992998 | rmse: [0.05621025] | r2 score: [0.99684041]
activationfunction1: Sigmoid | activationfunction2: Tanh | hidden layers: 20 | learning rate: 0.06 | iterations: 15 | training loss: 0.001649889792863483 | rmse: [0.05744371] | r2 score: [0.99670022]
activationfunction1: Sigmoid | activationfunction2: Tanh | hidden layers: 20 | learning rate: 0.06 | iterations: 15 | training loss: 0.0016978566535677778 | rmse: [0.05827275] | r2 score: [0.99660429]
activationfunction1: Sigmoid | activationfunction2: Tanh | hidden layers: 20 | learning rate: 0.06 | iterations: 15 | training loss: 0.001731875624151819 | rmse: [0.05885364] | r2 score: [0.99653625]
activationfunction1: Sigmoid | activationfunction2: Tanh | hidden layers: 20 | learning rate: 0.06 | iterations: 15 | training loss: 0.0017560126560881 | rmse: [0.05926234] | r2 score: [0.99648797]
activationfunction1: Sigmoid | activationfunction2: Tanh | hidden layers: 20 | learning rate: 0.06 | iterations: 15 | training loss: 0.0017726630511012496 | rmse: [0.05954264] | r2 score: [0.99645467]
activationfunction1: Sigmoid | activationfunction2: Tanh | hidden layers: 20 | learning rate: 0.06 | iterations: 15 | training loss: 0.0017834408130994628 | rmse: [0.05972338] | r2 score: [0.99643312]
activationfunction1: Sigmoid | activationfunction2: Tanh | hidden layers: 20 | learning rate: 0.06 | iterations: 15 | training loss: 0.0017895341266562388 | rmse: [0.05982532] | r2 score: [0.99642093]
activationfunction1: Sigmoid | activationfunction2: Tanh | hidden layers: 20 | learning rate: 0.06 | iterations: 15 | training loss: 0.0017918636748550842 | rmse: [0.05986424] | r2 score: [0.99641627]
activationfunction1: Sigmoid | activationfunction2: Tanh | hidden layers: 20 | learning rate: 0.06 | iterations: 15 | training loss: 0.0017911632254899422 | rmse: [0.05985254] | r2 score: [0.99641767]
activationfunction1: Sigmoid | activationfunction2: Tanh | hidden layers: 20 | learning rate: 0.06 | iterations: 15 | training loss: 0.0017880267659490209 | rmse: [0.05980011] | r2 score: [0.99642395]
activationfunction1: Sigmoid | activationfunction2: Tanh | hidden layers: 20 | learning rate: 0.06 | iterations: 15 | training loss: 0.0017829394815807812 | rmse: [0.05971498] | r2 score: [0.99643412]
[I 2023-08-01 19:23:27,915] Trial 99 finished with value: 0.9870622003312817 and parameters: {'learning_rate': 0.06, 'num_epochs': 15, 'initializer': 'Zero', 'num_hidden_units': 20}. Best is trial 58 with value: 0.9871385667925332.
activationfunction1: Sigmoid | activationfunction2: Tanh | hidden layers: 10 | learning rate: 0.06 | iterations: 5 | training loss: 1.2543482544928196e-05 | rmse: [0.00500869] | r2 score: [0.99997491]
activationfunction1: Sigmoid | activationfunction2: Tanh | hidden layers: 10 | learning rate: 0.06 | iterations: 5 | training loss: 0.0012412025678053048 | rmse: [0.04982374] | r2 score: [0.99751759]
activationfunction1: Sigmoid | activationfunction2: Tanh | hidden layers: 10 | learning rate: 0.06 | iterations: 5 | training loss: 0.001467902508327734 | rmse: [0.05418307] | r2 score: [0.99706419]
activationfunction1: Sigmoid | activationfunction2: Tanh | hidden layers: 10 | learning rate: 0.06 | iterations: 5 | training loss: 0.0015799215435386546 | rmse: [0.05621248] | r2 score: [0.99684016]
activationfunction1: Sigmoid | activationfunction2: Tanh | hidden layers: 10 | learning rate: 0.06 | iterations: 5 | training loss: 0.0016499322639096294 | rmse: [0.05744445] | r2 score: [0.99670014]