[I 2023-08-01 18:42:21,793] Trial 24 finished with value: 0.9871385475841614 and parameters: {'learning_rate': 0.06, 'num_epochs': 5, 'initializer': 'Xavier', 'num_hidden_units': 10}. Best is trial 17 with value: 0.9871385657535376.
activationfunction1: Sigmoid | activationfunction2: Tanh | hidden layers: 10 | learning rate: 0.06 | iterations: 5 | training loss: 3.5473583574220534e-05 | rmse: [0.00842301] | r2 score: [0.99992905]
activationfunction1: Sigmoid | activationfunction2: Tanh | hidden layers: 10 | learning rate: 0.06 | iterations: 5 | training loss: 0.0012450149818117376 | rmse: [0.0499002] | r2 score: [0.99750997]
activationfunction1: Sigmoid | activationfunction2: Tanh | hidden layers: 10 | learning rate: 0.06 | iterations: 5 | training loss: 0.0014688144351235706 | rmse: [0.0541999] | r2 score: [0.99706237]
activationfunction1: Sigmoid | activationfunction2: Tanh | hidden layers: 10 | learning rate: 0.06 | iterations: 5 | training loss: 0.0015802154934729943 | rmse: [0.05621771] | r2 score: [0.99683957]
[I 2023-08-01 18:42:57,586] Trial 25 finished with value: 0.9871385105111359 and parameters: {'learning_rate': 0.06, 'num_epochs': 5, 'initializer': 'Xavier', 'num_hidden_units': 10}. Best is trial 17 with value: 0.9871385657535376.
activationfunction1: Sigmoid | activationfunction2: Tanh | hidden layers: 10 | learning rate: 0.06 | iterations: 5 | training loss: 0.0016500320065611607 | rmse: [0.05744618] | r2 score: [0.99669994]
activationfunction1: Sigmoid | activationfunction2: Tanh | hidden layers: 10 | learning rate: 0.06 | iterations: 5 | training loss: 2.6151478453324333e-06 | rmse: [0.00228698] | r2 score: [0.99999477]
activationfunction1: Sigmoid | activationfunction2: Tanh | hidden layers: 10 | learning rate: 0.06 | iterations: 5 | training loss: 0.0012395401341692405 | rmse: [0.04979036] | r2 score: [0.99752092]
activationfunction1: Sigmoid | activationfunction2: Tanh | hidden layers: 10 | learning rate: 0.06 | iterations: 5 | training loss: 0.0014675056568088057 | rmse: [0.05417575] | r2 score: [0.99706499]
activationfunction1: Sigmoid | activationfunction2: Tanh | hidden layers: 10 | learning rate: 0.06 | iterations: 5 | training loss: 0.0015797937548130854 | rmse: [0.05621021] | r2 score: [0.99684041]
[I 2023-08-01 18:43:22,811] Trial 26 finished with value: 0.9871385662349578 and parameters: {'learning_rate': 0.06, 'num_epochs': 5, 'initializer': 'Xavier', 'num_hidden_units': 10}. Best is trial 26 with value: 0.9871385662349578.
activationfunction1: Sigmoid | activationfunction2: Tanh | hidden layers: 10 | learning rate: 0.06 | iterations: 5 | training loss: 0.0016498889138479495 | rmse: [0.05744369] | r2 score: [0.99670022]
activationfunction1: Sigmoid | activationfunction2: Tanh | hidden layers: 10 | learning rate: 0.06 | iterations: 5 | training loss: 3.1541177639378994e-06 | rmse: [0.00251162] | r2 score: [0.99999369]
activationfunction1: Sigmoid | activationfunction2: Tanh | hidden layers: 10 | learning rate: 0.06 | iterations: 5 | training loss: 0.001239630026874829 | rmse: [0.04979217] | r2 score: [0.99752074]
activationfunction1: Sigmoid | activationfunction2: Tanh | hidden layers: 10 | learning rate: 0.06 | iterations: 5 | training loss: 0.00146752720661601 | rmse: [0.05417614] | r2 score: [0.99706495]
activationfunction1: Sigmoid | activationfunction2: Tanh | hidden layers: 10 | learning rate: 0.06 | iterations: 5 | training loss: 0.0015798006919296305 | rmse: [0.05621033] | r2 score: [0.9968404]
activationfunction1: Sigmoid | activationfunction2: Tanh | hidden layers: 10 | learning rate: 0.06 | iterations: 5 | training loss: 0.0016498912669704363 | rmse: [0.05744373] | r2 score: [0.99670022]
[I 2023-08-01 18:43:47,713] Trial 27 finished with value: 0.9871385653186535 and parameters: {'learning_rate': 0.06, 'num_epochs': 5, 'initializer': 'Xavier', 'num_hidden_units': 10}. Best is trial 26 with value: 0.9871385662349578.
activationfunction1: Sigmoid | activationfunction2: Tanh | hidden layers: 10 | learning rate: 0.01 | iterations: 15 | training loss: 1.938654448503709e-06 | rmse: [0.00196909] | r2 score: [0.99999612]
activationfunction1: Sigmoid | activationfunction2: Tanh | hidden layers: 10 | learning rate: 0.01 | iterations: 15 | training loss: 0.00470136011148247 | rmse: [0.09696762] | r2 score: [0.99059728]
activationfunction1: Sigmoid | activationfunction2: Tanh | hidden layers: 10 | learning rate: 0.01 | iterations: 15 | training loss: 0.006814747461242988 | rmse: [0.11674543] | r2 score: [0.98637051]
activationfunction1: Sigmoid | activationfunction2: Tanh | hidden layers: 10 | learning rate: 0.01 | iterations: 15 | training loss: 0.008132013263732503 | rmse: [0.1275305] | r2 score: [0.98373597]
activationfunction1: Sigmoid | activationfunction2: Tanh | hidden layers: 10 | learning rate: 0.01 | iterations: 15 | training loss: 0.009014706933551737 | rmse: [0.13427365] | r2 score: [0.98197059]
activationfunction1: Sigmoid | activationfunction2: Tanh | hidden layers: 10 | learning rate: 0.01 | iterations: 15 | training loss: 0.00962533015650443 | rmse: [0.13874675] | r2 score: [0.98074934]
activationfunction1: Sigmoid | activationfunction2: Tanh | hidden layers: 10 | learning rate: 0.01 | iterations: 15 | training loss: 0.010052947856818432 | rmse: [0.14179526] | r2 score: [0.9798941]
activationfunction1: Sigmoid | activationfunction2: Tanh | hidden layers: 10 | learning rate: 0.01 | iterations: 15 | training loss: 0.010350837027717026 | rmse: [0.14388077] | r2 score: [0.97929833]
activationfunction1: Sigmoid | activationfunction2: Tanh | hidden layers: 10 | learning rate: 0.01 | iterations: 15 | training loss: 0.0105530970877236 | rmse: [0.1452797] | r2 score: [0.97889381]
activationfunction1: Sigmoid | activationfunction2: Tanh | hidden layers: 10 | learning rate: 0.01 | iterations: 15 | training loss: 0.010682817776929846 | rmse: [0.14616989] | r2 score: [0.97863436]
activationfunction1: Sigmoid | activationfunction2: Tanh | hidden layers: 10 | learning rate: 0.01 | iterations: 15 | training loss: 0.01075636790646513 | rmse: [0.1466722] | r2 score: [0.97848726]
activationfunction1: Sigmoid | activationfunction2: Tanh | hidden layers: 10 | learning rate: 0.01 | iterations: 15 | training loss: 0.010785783380992729 | rmse: [0.14687262] | r2 score: [0.97842843]
activationfunction1: Sigmoid | activationfunction2: Tanh | hidden layers: 10 | learning rate: 0.01 | iterations: 15 | training loss: 0.010780173328229926 | rmse: [0.14683442] | r2 score: [0.97843965]
activationfunction1: Sigmoid | activationfunction2: Tanh | hidden layers: 10 | learning rate: 0.01 | iterations: 15 | training loss: 0.010746591692137283 | rmse: [0.14660554] | r2 score: [0.97850682]
[I 2023-08-01 18:45:01,902] Trial 28 finished with value: 0.9779883761409817 and parameters: {'learning_rate': 0.01, 'num_epochs': 15, 'initializer': 'Zero', 'num_hidden_units': 10}. Best is trial 26 with value: 0.9871385662349578.
activationfunction1: Sigmoid | activationfunction2: Tanh | hidden layers: 10 | learning rate: 0.01 | iterations: 15 | training loss: 0.010690602329307589 | rmse: [0.14622313] | r2 score: [0.9786188]
activationfunction1: Sigmoid | activationfunction2: Tanh | hidden layers: 20 | learning rate: 0.03 | iterations: 10 | training loss: 0.001012374316085085 | rmse: [0.04499721] | r2 score: [0.99797525]
activationfunction1: Sigmoid | activationfunction2: Tanh | hidden layers: 20 | learning rate: 0.03 | iterations: 10 | training loss: 0.0019197628172830628 | rmse: [0.0619639] | r2 score: [0.99616047]
activationfunction1: Sigmoid | activationfunction2: Tanh | hidden layers: 20 | learning rate: 0.03 | iterations: 10 | training loss: 0.0022887326578443553 | rmse: [0.06765697] | r2 score: [0.99542253]
activationfunction1: Sigmoid | activationfunction2: Tanh | hidden layers: 20 | learning rate: 0.03 | iterations: 10 | training loss: 0.002534674260037567 | rmse: [0.07119936] | r2 score: [0.99493065]
activationfunction1: Sigmoid | activationfunction2: Tanh | hidden layers: 20 | learning rate: 0.03 | iterations: 10 | training loss: 0.00270955199374309 | rmse: [0.07361456] | r2 score: [0.9945809]
activationfunction1: Sigmoid | activationfunction2: Tanh | hidden layers: 20 | learning rate: 0.03 | iterations: 10 | training loss: 0.002837116669156927 | rmse: [0.07532751] | r2 score: [0.99432577]
activationfunction1: Sigmoid | activationfunction2: Tanh | hidden layers: 20 | learning rate: 0.03 | iterations: 10 | training loss: 0.00293045552015674 | rmse: [0.07655659] | r2 score: [0.99413909]
activationfunction1: Sigmoid | activationfunction2: Tanh | hidden layers: 20 | learning rate: 0.03 | iterations: 10 | training loss: 0.0029977639335112753 | rmse: [0.07743079] | r2 score: [0.99400447]
activationfunction1: Sigmoid | activationfunction2: Tanh | hidden layers: 20 | learning rate: 0.03 | iterations: 10 | training loss: 0.0030446929815810663 | rmse: [0.07803452] | r2 score: [0.99391061]
[I 2023-08-01 18:45:55,538] Trial 29 finished with value: 0.9862168744804765 and parameters: {'learning_rate': 0.03, 'num_epochs': 10, 'initializer': 'Random', 'num_hidden_units': 20}. Best is trial 26 with value: 0.9871385662349578.
activationfunction1: Sigmoid | activationfunction2: Tanh | hidden layers: 20 | learning rate: 0.03 | iterations: 10 | training loss: 0.003075408099453576 | rmse: [0.07842714] | r2 score: [0.99384918]
activationfunction1: Sigmoid | activationfunction2: Tanh | hidden layers: 10 | learning rate: 0.06 | iterations: 10 | training loss: 2.8174194729835215e-06 | rmse: [0.00237378] | r2 score: [0.99999437]
activationfunction1: Sigmoid | activationfunction2: Tanh | hidden layers: 10 | learning rate: 0.06 | iterations: 10 | training loss: 0.0012395736980134135 | rmse: [0.04979104] | r2 score: [0.99752085]
activationfunction1: Sigmoid | activationfunction2: Tanh | hidden layers: 10 | learning rate: 0.06 | iterations: 10 | training loss: 0.0014675137069070378 | rmse: [0.05417589] | r2 score: [0.99706497]
activationfunction1: Sigmoid | activationfunction2: Tanh | hidden layers: 10 | learning rate: 0.06 | iterations: 10 | training loss: 0.0015797963461992998 | rmse: [0.05621025] | r2 score: [0.99684041]
activationfunction1: Sigmoid | activationfunction2: Tanh | hidden layers: 10 | learning rate: 0.06 | iterations: 10 | training loss: 0.001649889792863483 | rmse: [0.05744371] | r2 score: [0.99670022]
activationfunction1: Sigmoid | activationfunction2: Tanh | hidden layers: 10 | learning rate: 0.06 | iterations: 10 | training loss: 0.0016978566535677778 | rmse: [0.05827275] | r2 score: [0.99660429]
activationfunction1: Sigmoid | activationfunction2: Tanh | hidden layers: 10 | learning rate: 0.06 | iterations: 10 | training loss: 0.001731875624151819 | rmse: [0.05885364] | r2 score: [0.99653625]
activationfunction1: Sigmoid | activationfunction2: Tanh | hidden layers: 10 | learning rate: 0.06 | iterations: 10 | training loss: 0.0017560126560881 | rmse: [0.05926234] | r2 score: [0.99648797]
activationfunction1: Sigmoid | activationfunction2: Tanh | hidden layers: 10 | learning rate: 0.06 | iterations: 10 | training loss: 0.0017726630511012496 | rmse: [0.05954264] | r2 score: [0.99645467]
[I 2023-08-01 18:46:44,457] Trial 30 finished with value: 0.9870613416929033 and parameters: {'learning_rate': 0.06, 'num_epochs': 10, 'initializer': 'Zero', 'num_hidden_units': 10}. Best is trial 26 with value: 0.9871385662349578.
activationfunction1: Sigmoid | activationfunction2: Tanh | hidden layers: 10 | learning rate: 0.06 | iterations: 10 | training loss: 0.0017834408130994628 | rmse: [0.05972338] | r2 score: [0.99643312]
activationfunction1: Sigmoid | activationfunction2: Tanh | hidden layers: 10 | learning rate: 0.06 | iterations: 5 | training loss: 7.2878804166104095e-06 | rmse: [0.00381782] | r2 score: [0.99998542]
activationfunction1: Sigmoid | activationfunction2: Tanh | hidden layers: 10 | learning rate: 0.06 | iterations: 5 | training loss: 0.0012403227924197371 | rmse: [0.04980608] | r2 score: [0.99751935]
activationfunction1: Sigmoid | activationfunction2: Tanh | hidden layers: 10 | learning rate: 0.06 | iterations: 5 | training loss: 0.0014676927078225211 | rmse: [0.0541792] | r2 score: [0.99706461]
activationfunction1: Sigmoid | activationfunction2: Tanh | hidden layers: 10 | learning rate: 0.06 | iterations: 5 | training loss: 0.0015798539764444977 | rmse: [0.05621128] | r2 score: [0.99684029]
[I 2023-08-01 18:47:09,324] Trial 31 finished with value: 0.9871385582801294 and parameters: {'learning_rate': 0.06, 'num_epochs': 5, 'initializer': 'Xavier', 'num_hidden_units': 10}. Best is trial 26 with value: 0.9871385662349578.
activationfunction1: Sigmoid | activationfunction2: Tanh | hidden layers: 10 | learning rate: 0.06 | iterations: 5 | training loss: 0.0016499093421377302 | rmse: [0.05744405] | r2 score: [0.99670018]
activationfunction1: Sigmoid | activationfunction2: Tanh | hidden layers: 10 | learning rate: 0.06 | iterations: 5 | training loss: 1.4127746866610036e-05 | rmse: [0.00531559] | r2 score: [0.99997174]
activationfunction1: Sigmoid | activationfunction2: Tanh | hidden layers: 10 | learning rate: 0.06 | iterations: 5 | training loss: 0.0012414678967270782 | rmse: [0.04982907] | r2 score: [0.99751706]
activationfunction1: Sigmoid | activationfunction2: Tanh | hidden layers: 10 | learning rate: 0.06 | iterations: 5 | training loss: 0.0014679657899979016 | rmse: [0.05418424] | r2 score: [0.99706407]
activationfunction1: Sigmoid | activationfunction2: Tanh | hidden layers: 10 | learning rate: 0.06 | iterations: 5 | training loss: 0.0015799419280527565 | rmse: [0.05621285] | r2 score: [0.99684012]
[I 2023-08-01 18:47:34,280] Trial 32 finished with value: 0.9871385466610709 and parameters: {'learning_rate': 0.06, 'num_epochs': 5, 'initializer': 'Xavier', 'num_hidden_units': 10}. Best is trial 26 with value: 0.9871385662349578.
activationfunction1: Sigmoid | activationfunction2: Tanh | hidden layers: 10 | learning rate: 0.06 | iterations: 5 | training loss: 0.0016499391796125393 | rmse: [0.05744457] | r2 score: [0.99670012]
activationfunction1: Sigmoid | activationfunction2: Tanh | hidden layers: 10 | learning rate: 0.06 | iterations: 5 | training loss: 3.1634684861471835e-06 | rmse: [0.00251534] | r2 score: [0.99999367]
activationfunction1: Sigmoid | activationfunction2: Tanh | hidden layers: 10 | learning rate: 0.06 | iterations: 5 | training loss: 0.001239631347005517 | rmse: [0.04979219] | r2 score: [0.99752074]
activationfunction1: Sigmoid | activationfunction2: Tanh | hidden layers: 10 | learning rate: 0.06 | iterations: 5 | training loss: 0.0014675275228568318 | rmse: [0.05417615] | r2 score: [0.99706494]
activationfunction1: Sigmoid | activationfunction2: Tanh | hidden layers: 10 | learning rate: 0.06 | iterations: 5 | training loss: 0.0015798007937327368 | rmse: [0.05621033] | r2 score: [0.9968404]
activationfunction1: Sigmoid | activationfunction2: Tanh | hidden layers: 10 | learning rate: 0.06 | iterations: 5 | training loss: 0.0016498913015029698 | rmse: [0.05744373] | r2 score: [0.99670022]
[I 2023-08-01 18:47:59,175] Trial 33 finished with value: 0.9871385653052065 and parameters: {'learning_rate': 0.06, 'num_epochs': 5, 'initializer': 'Xavier', 'num_hidden_units': 10}. Best is trial 26 with value: 0.9871385662349578.
activationfunction1: Sigmoid | activationfunction2: Tanh | hidden layers: 20 | learning rate: 0.06 | iterations: 5 | training loss: 9.920628955657487e-06 | rmse: [0.00445435] | r2 score: [0.99998016]
activationfunction1: Sigmoid | activationfunction2: Tanh | hidden layers: 20 | learning rate: 0.06 | iterations: 5 | training loss: 0.001240762971107927 | rmse: [0.04981492] | r2 score: [0.99751847]
activationfunction1: Sigmoid | activationfunction2: Tanh | hidden layers: 20 | learning rate: 0.06 | iterations: 5 | training loss: 0.0014677976840091146 | rmse: [0.05418114] | r2 score: [0.9970644]
activationfunction1: Sigmoid | activationfunction2: Tanh | hidden layers: 20 | learning rate: 0.06 | iterations: 5 | training loss: 0.0015798877816454162 | rmse: [0.05621188] | r2 score: [0.99684022]
[I 2023-08-01 18:48:25,814] Trial 34 finished with value: 0.9871385538143957 and parameters: {'learning_rate': 0.06, 'num_epochs': 5, 'initializer': 'Xavier', 'num_hidden_units': 20}. Best is trial 26 with value: 0.9871385662349578.
activationfunction1: Sigmoid | activationfunction2: Tanh | hidden layers: 20 | learning rate: 0.06 | iterations: 5 | training loss: 0.001649920810136274 | rmse: [0.05744425] | r2 score: [0.99670016]
activationfunction1: Sigmoid | activationfunction2: Tanh | hidden layers: 10 | learning rate: 0.06 | iterations: 5 | training loss: 7.115995657722104e-06 | rmse: [0.00377253] | r2 score: [0.99998577]
activationfunction1: Sigmoid | activationfunction2: Tanh | hidden layers: 10 | learning rate: 0.06 | iterations: 5 | training loss: 0.001240292787172628 | rmse: [0.04980548] | r2 score: [0.99751941]
activationfunction1: Sigmoid | activationfunction2: Tanh | hidden layers: 10 | learning rate: 0.06 | iterations: 5 | training loss: 0.0014676855497834486 | rmse: [0.05417906] | r2 score: [0.99706463]
activationfunction1: Sigmoid | activationfunction2: Tanh | hidden layers: 10 | learning rate: 0.06 | iterations: 5 | training loss: 0.0015798516715646352 | rmse: [0.05621124] | r2 score: [0.9968403]
activationfunction1: Sigmoid | activationfunction2: Tanh | hidden layers: 10 | learning rate: 0.06 | iterations: 5 | training loss: 0.0016499085602526072 | rmse: [0.05744404] | r2 score: [0.99670018]
[I 2023-08-01 18:48:50,617] Trial 35 finished with value: 0.9871385585846003 and parameters: {'learning_rate': 0.06, 'num_epochs': 5, 'initializer': 'Random', 'num_hidden_units': 10}. Best is trial 26 with value: 0.9871385662349578.
activationfunction1: Sigmoid | activationfunction2: Tanh | hidden layers: 10 | learning rate: 0.03 | iterations: 15 | training loss: 2.2863286693614647e-06 | rmse: [0.00213838] | r2 score: [0.99999543]
activationfunction1: Sigmoid | activationfunction2: Tanh | hidden layers: 10 | learning rate: 0.03 | iterations: 15 | training loss: 0.0017426220297097126 | rmse: [0.05903596] | r2 score: [0.99651476]
activationfunction1: Sigmoid | activationfunction2: Tanh | hidden layers: 10 | learning rate: 0.03 | iterations: 15 | training loss: 0.002232909058651486 | rmse: [0.06682678] | r2 score: [0.99553418]
activationfunction1: Sigmoid | activationfunction2: Tanh | hidden layers: 10 | learning rate: 0.03 | iterations: 15 | training loss: 0.0025144143690851873 | rmse: [0.07091423] | r2 score: [0.99497117]
activationfunction1: Sigmoid | activationfunction2: Tanh | hidden layers: 10 | learning rate: 0.03 | iterations: 15 | training loss: 0.0027019939649547955 | rmse: [0.07351182] | r2 score: [0.99459601]
activationfunction1: Sigmoid | activationfunction2: Tanh | hidden layers: 10 | learning rate: 0.03 | iterations: 15 | training loss: 0.0028342741497451866 | rmse: [0.07528976] | r2 score: [0.99433145]
activationfunction1: Sigmoid | activationfunction2: Tanh | hidden layers: 10 | learning rate: 0.03 | iterations: 15 | training loss: 0.0029293835174647536 | rmse: [0.07654258] | r2 score: [0.99414123]
activationfunction1: Sigmoid | activationfunction2: Tanh | hidden layers: 10 | learning rate: 0.03 | iterations: 15 | training loss: 0.0029973592901101753 | rmse: [0.07742557] | r2 score: [0.99400528]
activationfunction1: Sigmoid | activationfunction2: Tanh | hidden layers: 10 | learning rate: 0.03 | iterations: 15 | training loss: 0.003044540230633047 | rmse: [0.07803256] | r2 score: [0.99391092]
activationfunction1: Sigmoid | activationfunction2: Tanh | hidden layers: 10 | learning rate: 0.03 | iterations: 15 | training loss: 0.003075350456721808 | rmse: [0.07842641] | r2 score: [0.9938493]
activationfunction1: Sigmoid | activationfunction2: Tanh | hidden layers: 10 | learning rate: 0.03 | iterations: 15 | training loss: 0.003093092437471572 | rmse: [0.07865231] | r2 score: [0.99381382]
activationfunction1: Sigmoid | activationfunction2: Tanh | hidden layers: 10 | learning rate: 0.03 | iterations: 15 | training loss: 0.0031003355333647942 | rmse: [0.07874434] | r2 score: [0.99379933]
activationfunction1: Sigmoid | activationfunction2: Tanh | hidden layers: 10 | learning rate: 0.03 | iterations: 15 | training loss: 0.003099128443827796 | rmse: [0.07872901] | r2 score: [0.99380174]
activationfunction1: Sigmoid | activationfunction2: Tanh | hidden layers: 10 | learning rate: 0.03 | iterations: 15 | training loss: 0.0030911287648367745 | rmse: [0.07862733] | r2 score: [0.99381774]
[I 2023-08-01 18:50:04,291] Trial 36 finished with value: 0.9862170101198457 and parameters: {'learning_rate': 0.03, 'num_epochs': 15, 'initializer': 'Zero', 'num_hidden_units': 10}. Best is trial 26 with value: 0.9871385662349578.
activationfunction1: Sigmoid | activationfunction2: Tanh | hidden layers: 10 | learning rate: 0.03 | iterations: 15 | training loss: 0.0030776896563384317 | rmse: [0.07845622] | r2 score: [0.99384462]
activationfunction1: Sigmoid | activationfunction2: Tanh | hidden layers: 15 | learning rate: 0.06 | iterations: 5 | training loss: 2.8784594793895923e-05 | rmse: [0.00758744] | r2 score: [0.99994243]
activationfunction1: Sigmoid | activationfunction2: Tanh | hidden layers: 15 | learning rate: 0.06 | iterations: 5 | training loss: 0.0012439097302419687 | rmse: [0.04987805] | r2 score: [0.99751218]
activationfunction1: Sigmoid | activationfunction2: Tanh | hidden layers: 15 | learning rate: 0.06 | iterations: 5 | training loss: 0.001468549357120426 | rmse: [0.05419501] | r2 score: [0.9970629]
activationfunction1: Sigmoid | activationfunction2: Tanh | hidden layers: 15 | learning rate: 0.06 | iterations: 5 | training loss: 0.001580130004783333 | rmse: [0.05621619] | r2 score: [0.99683974]
