[I 2023-08-01 18:34:49,553] Trial 9 finished with value: 0.9862170101201182 and parameters: {'learning_rate': 0.03, 'num_epochs': 15, 'initializer': 'Xavier', 'num_hidden_units': 10}. Best is trial 7 with value: 0.9871385290985513.
activationfunction1: Sigmoid | activationfunction2: Tanh | hidden layers: 10 | learning rate: 0.03 | iterations: 15 | training loss: 0.003077689655834563 | rmse: [0.07845622] | r2 score: [0.99384462]
activationfunction1: Sigmoid | activationfunction2: Tanh | hidden layers: 20 | learning rate: 0.06 | iterations: 10 | training loss: 1.4552016815116701e-05 | rmse: [0.00539482] | r2 score: [0.9999709]
activationfunction1: Sigmoid | activationfunction2: Tanh | hidden layers: 20 | learning rate: 0.06 | iterations: 10 | training loss: 0.0012415388884663451 | rmse: [0.04983049] | r2 score: [0.99751692]
activationfunction1: Sigmoid | activationfunction2: Tanh | hidden layers: 20 | learning rate: 0.06 | iterations: 10 | training loss: 0.0014679827243809164 | rmse: [0.05418455] | r2 score: [0.99706403]
activationfunction1: Sigmoid | activationfunction2: Tanh | hidden layers: 20 | learning rate: 0.06 | iterations: 10 | training loss: 0.001579947383361452 | rmse: [0.05621294] | r2 score: [0.99684011]
activationfunction1: Sigmoid | activationfunction2: Tanh | hidden layers: 20 | learning rate: 0.06 | iterations: 10 | training loss: 0.0016499410304234867 | rmse: [0.0574446] | r2 score: [0.99670012]
activationfunction1: Sigmoid | activationfunction2: Tanh | hidden layers: 20 | learning rate: 0.06 | iterations: 10 | training loss: 0.0016978742611717937 | rmse: [0.05827305] | r2 score: [0.99660425]
activationfunction1: Sigmoid | activationfunction2: Tanh | hidden layers: 20 | learning rate: 0.06 | iterations: 10 | training loss: 0.0017318816955082762 | rmse: [0.05885375] | r2 score: [0.99653624]
activationfunction1: Sigmoid | activationfunction2: Tanh | hidden layers: 20 | learning rate: 0.06 | iterations: 10 | training loss: 0.0017560147508586046 | rmse: [0.05926238] | r2 score: [0.99648797]
activationfunction1: Sigmoid | activationfunction2: Tanh | hidden layers: 20 | learning rate: 0.06 | iterations: 10 | training loss: 0.0017726637736167384 | rmse: [0.05954265] | r2 score: [0.99645467]
activationfunction1: Sigmoid | activationfunction2: Tanh | hidden layers: 20 | learning rate: 0.06 | iterations: 10 | training loss: 0.0017834410621305693 | rmse: [0.05972338] | r2 score: [0.99643312]
[I 2023-08-01 18:35:41,860] Trial 10 finished with value: 0.9870613415898566 and parameters: {'learning_rate': 0.06, 'num_epochs': 10, 'initializer': 'Xavier', 'num_hidden_units': 20}. Best is trial 7 with value: 0.9871385290985513.
activationfunction1: Sigmoid | activationfunction2: Tanh | hidden layers: 10 | learning rate: 0.06 | iterations: 5 | training loss: 6.392527257320406e-06 | rmse: [0.00357562] | r2 score: [0.99998721]
activationfunction1: Sigmoid | activationfunction2: Tanh | hidden layers: 10 | learning rate: 0.06 | iterations: 5 | training loss: 0.0012401715399339877 | rmse: [0.04980304] | r2 score: [0.99751966]
activationfunction1: Sigmoid | activationfunction2: Tanh | hidden layers: 10 | learning rate: 0.06 | iterations: 5 | training loss: 0.001467656619906265 | rmse: [0.05417853] | r2 score: [0.99706469]
activationfunction1: Sigmoid | activationfunction2: Tanh | hidden layers: 10 | learning rate: 0.06 | iterations: 5 | training loss: 0.0015798423564451964 | rmse: [0.05621107] | r2 score: [0.99684032]
[I 2023-08-01 18:36:06,551] Trial 11 finished with value: 0.9871385598151013 and parameters: {'learning_rate': 0.06, 'num_epochs': 5, 'initializer': 'Xavier', 'num_hidden_units': 10}. Best is trial 11 with value: 0.9871385598151013.
activationfunction1: Sigmoid | activationfunction2: Tanh | hidden layers: 10 | learning rate: 0.06 | iterations: 5 | training loss: 0.0016499054003038466 | rmse: [0.05744398] | r2 score: [0.99670019]
activationfunction1: Sigmoid | activationfunction2: Tanh | hidden layers: 10 | learning rate: 0.06 | iterations: 5 | training loss: 3.7214755680294587e-06 | rmse: [0.00272818] | r2 score: [0.99999256]
activationfunction1: Sigmoid | activationfunction2: Tanh | hidden layers: 10 | learning rate: 0.06 | iterations: 5 | training loss: 0.0012397248681983576 | rmse: [0.04979407] | r2 score: [0.99752055]
activationfunction1: Sigmoid | activationfunction2: Tanh | hidden layers: 10 | learning rate: 0.06 | iterations: 5 | training loss: 0.0014675499123702144 | rmse: [0.05417656] | r2 score: [0.9970649]
activationfunction1: Sigmoid | activationfunction2: Tanh | hidden layers: 10 | learning rate: 0.06 | iterations: 5 | training loss: 0.001579808001413914 | rmse: [0.05621046] | r2 score: [0.99684038]
[I 2023-08-01 18:36:31,398] Trial 12 finished with value: 0.9871385643531538 and parameters: {'learning_rate': 0.06, 'num_epochs': 5, 'initializer': 'Xavier', 'num_hidden_units': 10}. Best is trial 12 with value: 0.9871385643531538.
activationfunction1: Sigmoid | activationfunction2: Tanh | hidden layers: 10 | learning rate: 0.06 | iterations: 5 | training loss: 0.0016498937464241835 | rmse: [0.05744378] | r2 score: [0.99670021]
activationfunction1: Sigmoid | activationfunction2: Tanh | hidden layers: 10 | learning rate: 0.06 | iterations: 5 | training loss: 4.339381787498047e-06 | rmse: [0.00294597] | r2 score: [0.99999132]
activationfunction1: Sigmoid | activationfunction2: Tanh | hidden layers: 10 | learning rate: 0.06 | iterations: 5 | training loss: 0.0012398277536993323 | rmse: [0.04979614] | r2 score: [0.99752034]
activationfunction1: Sigmoid | activationfunction2: Tanh | hidden layers: 10 | learning rate: 0.06 | iterations: 5 | training loss: 0.0014675745182997026 | rmse: [0.05417702] | r2 score: [0.99706485]
activationfunction1: Sigmoid | activationfunction2: Tanh | hidden layers: 10 | learning rate: 0.06 | iterations: 5 | training loss: 0.0015798159229030717 | rmse: [0.0562106] | r2 score: [0.99684037]
[I 2023-08-01 18:36:56,078] Trial 13 finished with value: 0.987138563306803 and parameters: {'learning_rate': 0.06, 'num_epochs': 5, 'initializer': 'Xavier', 'num_hidden_units': 10}. Best is trial 12 with value: 0.9871385643531538.
activationfunction1: Sigmoid | activationfunction2: Tanh | hidden layers: 10 | learning rate: 0.06 | iterations: 5 | training loss: 0.0016498964335010598 | rmse: [0.05744382] | r2 score: [0.99670021]
activationfunction1: Sigmoid | activationfunction2: Tanh | hidden layers: 10 | learning rate: 0.06 | iterations: 5 | training loss: 2.1965638719623704e-05 | rmse: [0.00662807] | r2 score: [0.99995607]
activationfunction1: Sigmoid | activationfunction2: Tanh | hidden layers: 10 | learning rate: 0.06 | iterations: 5 | training loss: 0.0012427768847275422 | rmse: [0.04985533] | r2 score: [0.99751445]
activationfunction1: Sigmoid | activationfunction2: Tanh | hidden layers: 10 | learning rate: 0.06 | iterations: 5 | training loss: 0.0014682783048651053 | rmse: [0.05419001] | r2 score: [0.99706344]
activationfunction1: Sigmoid | activationfunction2: Tanh | hidden layers: 10 | learning rate: 0.06 | iterations: 5 | training loss: 0.0015800426263237702 | rmse: [0.05621463] | r2 score: [0.99683991]
[I 2023-08-01 18:37:20,945] Trial 14 finished with value: 0.9871385333561788 and parameters: {'learning_rate': 0.06, 'num_epochs': 5, 'initializer': 'Xavier', 'num_hidden_units': 10}. Best is trial 12 with value: 0.9871385643531538.
activationfunction1: Sigmoid | activationfunction2: Tanh | hidden layers: 10 | learning rate: 0.06 | iterations: 5 | training loss: 0.0016499733452606665 | rmse: [0.05744516] | r2 score: [0.99670005]
activationfunction1: Sigmoid | activationfunction2: Tanh | hidden layers: 10 | learning rate: 0.01 | iterations: 5 | training loss: 5.448571874440824e-06 | rmse: [0.00330108] | r2 score: [0.9999891]
activationfunction1: Sigmoid | activationfunction2: Tanh | hidden layers: 10 | learning rate: 0.01 | iterations: 5 | training loss: 0.004701104303557385 | rmse: [0.09696499] | r2 score: [0.99059779]
activationfunction1: Sigmoid | activationfunction2: Tanh | hidden layers: 10 | learning rate: 0.01 | iterations: 5 | training loss: 0.006814878443355002 | rmse: [0.11674655] | r2 score: [0.98637024]
activationfunction1: Sigmoid | activationfunction2: Tanh | hidden layers: 10 | learning rate: 0.01 | iterations: 5 | training loss: 0.008132063980687563 | rmse: [0.12753089] | r2 score: [0.98373587]
activationfunction1: Sigmoid | activationfunction2: Tanh | hidden layers: 10 | learning rate: 0.01 | iterations: 5 | training loss: 0.009014727006982665 | rmse: [0.1342738] | r2 score: [0.98197055]
[I 2023-08-01 18:37:45,599] Trial 15 finished with value: 0.9803579676494971 and parameters: {'learning_rate': 0.01, 'num_epochs': 5, 'initializer': 'Xavier', 'num_hidden_units': 10}. Best is trial 12 with value: 0.9871385643531538.
activationfunction1: Sigmoid | activationfunction2: Tanh | hidden layers: 10 | learning rate: 0.06 | iterations: 10 | training loss: 4.25376228299393e-06 | rmse: [0.00291677] | r2 score: [0.99999149]
activationfunction1: Sigmoid | activationfunction2: Tanh | hidden layers: 10 | learning rate: 0.06 | iterations: 10 | training loss: 0.0012398139355950786 | rmse: [0.04979586] | r2 score: [0.99752037]
activationfunction1: Sigmoid | activationfunction2: Tanh | hidden layers: 10 | learning rate: 0.06 | iterations: 10 | training loss: 0.0014675712148633018 | rmse: [0.05417696] | r2 score: [0.99706486]
activationfunction1: Sigmoid | activationfunction2: Tanh | hidden layers: 10 | learning rate: 0.06 | iterations: 10 | training loss: 0.0015798148593961384 | rmse: [0.05621058] | r2 score: [0.99684037]
activationfunction1: Sigmoid | activationfunction2: Tanh | hidden layers: 10 | learning rate: 0.06 | iterations: 10 | training loss: 0.0016498960727435537 | rmse: [0.05744382] | r2 score: [0.99670021]
activationfunction1: Sigmoid | activationfunction2: Tanh | hidden layers: 10 | learning rate: 0.06 | iterations: 10 | training loss: 0.0016978588115755526 | rmse: [0.05827279] | r2 score: [0.99660428]
activationfunction1: Sigmoid | activationfunction2: Tanh | hidden layers: 10 | learning rate: 0.06 | iterations: 10 | training loss: 0.001731876368258635 | rmse: [0.05885366] | r2 score: [0.99653625]
activationfunction1: Sigmoid | activationfunction2: Tanh | hidden layers: 10 | learning rate: 0.06 | iterations: 10 | training loss: 0.0017560129128230406 | rmse: [0.05926235] | r2 score: [0.99648797]
activationfunction1: Sigmoid | activationfunction2: Tanh | hidden layers: 10 | learning rate: 0.06 | iterations: 10 | training loss: 0.0017726631396526322 | rmse: [0.05954264] | r2 score: [0.99645467]
[I 2023-08-01 18:38:35,363] Trial 16 finished with value: 0.9870613416802739 and parameters: {'learning_rate': 0.06, 'num_epochs': 10, 'initializer': 'Xavier', 'num_hidden_units': 10}. Best is trial 12 with value: 0.9871385643531538.
activationfunction1: Sigmoid | activationfunction2: Tanh | hidden layers: 10 | learning rate: 0.06 | iterations: 10 | training loss: 0.0017834408436206645 | rmse: [0.05972338] | r2 score: [0.99643312]
activationfunction1: Sigmoid | activationfunction2: Tanh | hidden layers: 10 | learning rate: 0.06 | iterations: 5 | training loss: 2.8994386234557856e-06 | rmse: [0.00240809] | r2 score: [0.9999942]
activationfunction1: Sigmoid | activationfunction2: Tanh | hidden layers: 10 | learning rate: 0.06 | iterations: 5 | training loss: 0.0012395873466442963 | rmse: [0.04979131] | r2 score: [0.99752083]
activationfunction1: Sigmoid | activationfunction2: Tanh | hidden layers: 10 | learning rate: 0.06 | iterations: 5 | training loss: 0.0014675169790532177 | rmse: [0.05417595] | r2 score: [0.99706497]
activationfunction1: Sigmoid | activationfunction2: Tanh | hidden layers: 10 | learning rate: 0.06 | iterations: 5 | training loss: 0.0015797973995368073 | rmse: [0.05621027] | r2 score: [0.99684041]
[I 2023-08-01 18:39:00,047] Trial 17 finished with value: 0.9871385657535376 and parameters: {'learning_rate': 0.06, 'num_epochs': 5, 'initializer': 'Xavier', 'num_hidden_units': 10}. Best is trial 17 with value: 0.9871385657535376.
activationfunction1: Sigmoid | activationfunction2: Tanh | hidden layers: 10 | learning rate: 0.06 | iterations: 5 | training loss: 0.0016498901501633963 | rmse: [0.05744371] | r2 score: [0.99670022]
activationfunction1: Sigmoid | activationfunction2: Tanh | hidden layers: 10 | learning rate: 0.03 | iterations: 5 | training loss: 3.152540417973107e-06 | rmse: [0.00251099] | r2 score: [0.99999369]
activationfunction1: Sigmoid | activationfunction2: Tanh | hidden layers: 10 | learning rate: 0.03 | iterations: 5 | training loss: 0.0017427965145673369 | rmse: [0.05903891] | r2 score: [0.99651441]
activationfunction1: Sigmoid | activationfunction2: Tanh | hidden layers: 10 | learning rate: 0.03 | iterations: 5 | training loss: 0.0022329619952682583 | rmse: [0.06682757] | r2 score: [0.99553408]
activationfunction1: Sigmoid | activationfunction2: Tanh | hidden layers: 10 | learning rate: 0.03 | iterations: 5 | training loss: 0.002514433288030523 | rmse: [0.0709145] | r2 score: [0.99497113]
[I 2023-08-01 18:39:25,235] Trial 18 finished with value: 0.9864664976155723 and parameters: {'learning_rate': 0.03, 'num_epochs': 5, 'initializer': 'Xavier', 'num_hidden_units': 10}. Best is trial 17 with value: 0.9871385657535376.
activationfunction1: Sigmoid | activationfunction2: Tanh | hidden layers: 10 | learning rate: 0.03 | iterations: 5 | training loss: 0.0027020009937839236 | rmse: [0.07351192] | r2 score: [0.994596]
activationfunction1: Sigmoid | activationfunction2: Tanh | hidden layers: 10 | learning rate: 0.01 | iterations: 10 | training loss: 1.938654448503709e-06 | rmse: [0.00196909] | r2 score: [0.99999612]
activationfunction1: Sigmoid | activationfunction2: Tanh | hidden layers: 10 | learning rate: 0.01 | iterations: 10 | training loss: 0.00470136011148247 | rmse: [0.09696762] | r2 score: [0.99059728]
activationfunction1: Sigmoid | activationfunction2: Tanh | hidden layers: 10 | learning rate: 0.01 | iterations: 10 | training loss: 0.006814747461242988 | rmse: [0.11674543] | r2 score: [0.98637051]
activationfunction1: Sigmoid | activationfunction2: Tanh | hidden layers: 10 | learning rate: 0.01 | iterations: 10 | training loss: 0.008132013263732503 | rmse: [0.1275305] | r2 score: [0.98373597]
activationfunction1: Sigmoid | activationfunction2: Tanh | hidden layers: 10 | learning rate: 0.01 | iterations: 10 | training loss: 0.009014706933551737 | rmse: [0.13427365] | r2 score: [0.98197059]
activationfunction1: Sigmoid | activationfunction2: Tanh | hidden layers: 10 | learning rate: 0.01 | iterations: 10 | training loss: 0.00962533015650443 | rmse: [0.13874675] | r2 score: [0.98074934]
activationfunction1: Sigmoid | activationfunction2: Tanh | hidden layers: 10 | learning rate: 0.01 | iterations: 10 | training loss: 0.010052947856818432 | rmse: [0.14179526] | r2 score: [0.9798941]
activationfunction1: Sigmoid | activationfunction2: Tanh | hidden layers: 10 | learning rate: 0.01 | iterations: 10 | training loss: 0.010350837027717026 | rmse: [0.14388077] | r2 score: [0.97929833]
activationfunction1: Sigmoid | activationfunction2: Tanh | hidden layers: 10 | learning rate: 0.01 | iterations: 10 | training loss: 0.0105530970877236 | rmse: [0.1452797] | r2 score: [0.97889381]
activationfunction1: Sigmoid | activationfunction2: Tanh | hidden layers: 10 | learning rate: 0.01 | iterations: 10 | training loss: 0.010682817776929846 | rmse: [0.14616989] | r2 score: [0.97863436]
[I 2023-08-01 18:40:15,072] Trial 19 finished with value: 0.9780025366523848 and parameters: {'learning_rate': 0.01, 'num_epochs': 10, 'initializer': 'Zero', 'num_hidden_units': 10}. Best is trial 17 with value: 0.9871385657535376.
activationfunction1: Sigmoid | activationfunction2: Tanh | hidden layers: 10 | learning rate: 0.06 | iterations: 5 | training loss: 3.5284932813021334e-05 | rmse: [0.00840059] | r2 score: [0.99992943]
activationfunction1: Sigmoid | activationfunction2: Tanh | hidden layers: 10 | learning rate: 0.06 | iterations: 5 | training loss: 0.0012449838942538121 | rmse: [0.04989958] | r2 score: [0.99751003]
activationfunction1: Sigmoid | activationfunction2: Tanh | hidden layers: 10 | learning rate: 0.06 | iterations: 5 | training loss: 0.001468806970272538 | rmse: [0.05419976] | r2 score: [0.99706239]
activationfunction1: Sigmoid | activationfunction2: Tanh | hidden layers: 10 | learning rate: 0.06 | iterations: 5 | training loss: 0.0015802130855405974 | rmse: [0.05621767] | r2 score: [0.99683957]
activationfunction1: Sigmoid | activationfunction2: Tanh | hidden layers: 10 | learning rate: 0.06 | iterations: 5 | training loss: 0.0016500311893616656 | rmse: [0.05744617] | r2 score: [0.99669994]
[I 2023-08-01 18:40:39,822] Trial 20 finished with value: 0.9871385108293943 and parameters: {'learning_rate': 0.06, 'num_epochs': 5, 'initializer': 'Xavier', 'num_hidden_units': 10}. Best is trial 17 with value: 0.9871385657535376.
activationfunction1: Sigmoid | activationfunction2: Tanh | hidden layers: 10 | learning rate: 0.06 | iterations: 5 | training loss: 4.207464728846475e-05 | rmse: [0.00917329] | r2 score: [0.99991585]
activationfunction1: Sigmoid | activationfunction2: Tanh | hidden layers: 10 | learning rate: 0.06 | iterations: 5 | training loss: 0.0012460996399966577 | rmse: [0.04992193] | r2 score: [0.9975078]
activationfunction1: Sigmoid | activationfunction2: Tanh | hidden layers: 10 | learning rate: 0.06 | iterations: 5 | training loss: 0.0014690752237806488 | rmse: [0.05420471] | r2 score: [0.99706185]
activationfunction1: Sigmoid | activationfunction2: Tanh | hidden layers: 10 | learning rate: 0.06 | iterations: 5 | training loss: 0.0015802996336883354 | rmse: [0.05621921] | r2 score: [0.9968394]
[I 2023-08-01 18:41:04,680] Trial 21 finished with value: 0.9871384993895221 and parameters: {'learning_rate': 0.06, 'num_epochs': 5, 'initializer': 'Xavier', 'num_hidden_units': 10}. Best is trial 17 with value: 0.9871385657535376.
activationfunction1: Sigmoid | activationfunction2: Tanh | hidden layers: 10 | learning rate: 0.06 | iterations: 5 | training loss: 0.0016500605633944375 | rmse: [0.05744668] | r2 score: [0.99669988]
activationfunction1: Sigmoid | activationfunction2: Tanh | hidden layers: 10 | learning rate: 0.06 | iterations: 5 | training loss: 5.628587668358182e-06 | rmse: [0.00335517] | r2 score: [0.99998874]
activationfunction1: Sigmoid | activationfunction2: Tanh | hidden layers: 10 | learning rate: 0.06 | iterations: 5 | training loss: 0.001240044342733372 | rmse: [0.04980049] | r2 score: [0.99751991]
activationfunction1: Sigmoid | activationfunction2: Tanh | hidden layers: 10 | learning rate: 0.06 | iterations: 5 | training loss: 0.0014676262587303864 | rmse: [0.05417797] | r2 score: [0.99706475]
activationfunction1: Sigmoid | activationfunction2: Tanh | hidden layers: 10 | learning rate: 0.06 | iterations: 5 | training loss: 0.0015798325809207863 | rmse: [0.0562109] | r2 score: [0.99684033]
[I 2023-08-01 18:41:29,549] Trial 22 finished with value: 0.9871385611064019 and parameters: {'learning_rate': 0.06, 'num_epochs': 5, 'initializer': 'Xavier', 'num_hidden_units': 10}. Best is trial 17 with value: 0.9871385657535376.
activationfunction1: Sigmoid | activationfunction2: Tanh | hidden layers: 10 | learning rate: 0.06 | iterations: 5 | training loss: 0.001649902084211014 | rmse: [0.05744392] | r2 score: [0.9967002]
activationfunction1: Sigmoid | activationfunction2: Tanh | hidden layers: 10 | learning rate: 0.06 | iterations: 5 | training loss: 3.5490879065717362e-06 | rmse: [0.00266424] | r2 score: [0.9999929]
activationfunction1: Sigmoid | activationfunction2: Tanh | hidden layers: 10 | learning rate: 0.06 | iterations: 5 | training loss: 0.001239696010457589 | rmse: [0.04979349] | r2 score: [0.99752061]
activationfunction1: Sigmoid | activationfunction2: Tanh | hidden layers: 10 | learning rate: 0.06 | iterations: 5 | training loss: 0.0014675430063448077 | rmse: [0.05417643] | r2 score: [0.99706491]
activationfunction1: Sigmoid | activationfunction2: Tanh | hidden layers: 10 | learning rate: 0.06 | iterations: 5 | training loss: 0.001579805778183867 | rmse: [0.05621042] | r2 score: [0.99684039]
activationfunction1: Sigmoid | activationfunction2: Tanh | hidden layers: 10 | learning rate: 0.06 | iterations: 5 | training loss: 0.001649892992278912 | rmse: [0.05744376] | r2 score: [0.99670021]
[I 2023-08-01 18:41:54,266] Trial 23 finished with value: 0.9871385646468183 and parameters: {'learning_rate': 0.06, 'num_epochs': 5, 'initializer': 'Xavier', 'num_hidden_units': 10}. Best is trial 17 with value: 0.9871385657535376.
activationfunction1: Sigmoid | activationfunction2: Tanh | hidden layers: 10 | learning rate: 0.06 | iterations: 5 | training loss: 1.3584817090053357e-05 | rmse: [0.00521245] | r2 score: [0.99997283]
activationfunction1: Sigmoid | activationfunction2: Tanh | hidden layers: 10 | learning rate: 0.06 | iterations: 5 | training loss: 0.001241376962488407 | rmse: [0.04982724] | r2 score: [0.99751725]
activationfunction1: Sigmoid | activationfunction2: Tanh | hidden layers: 10 | learning rate: 0.06 | iterations: 5 | training loss: 0.0014679441002896146 | rmse: [0.05418384] | r2 score: [0.99706411]
activationfunction1: Sigmoid | activationfunction2: Tanh | hidden layers: 10 | learning rate: 0.06 | iterations: 5 | training loss: 0.0015799349410580727 | rmse: [0.05621272] | r2 score: [0.99684013]
activationfunction1: Sigmoid | activationfunction2: Tanh | hidden layers: 10 | learning rate: 0.06 | iterations: 5 | training loss: 0.001649936809167539 | rmse: [0.05744453] | r2 score: [0.99670013]
